ts_code,exchange,question_id,question_time,answer_time,question,answer,answer_class,theme,story_read,proof_needed,credibility,source_url,source_type
000426.SZ,szse,2246246395443634176,2026-04-15,2026-04-29,请问截止4月10日股东人数是多少？,感谢您的关注！根据中登公司深圳分公司提供的数据，截至2026年4月10日，公司在册股东总户数为181279户。,substantive,unclassified,official interaction without a mapped investable theme,manual review required,higher-official-signal,https://irm.cninfo.com.cn/ircs/question/questionDetail?questionId=2246246395443634176,cninfo_irm
000426.SZ,szse,2241834999995641856,2026-04-09,2026-04-22,"2月，紫金矿业发布关于三年（2026-2028年）主要矿产品产量规划和2035年远景目标纲要的公告。
建议公司向优秀企业学习，加强与投资者互动，提高投资者认同度，谢谢。",感谢您的建议！您的建议我们会及时反馈给公司董事会及管理层。,substantive,unclassified,official interaction without a mapped investable theme,manual review required,higher-official-signal,https://irm.cninfo.com.cn/ircs/question/questionDetail?questionId=2241834999995641856,cninfo_irm
000426.SZ,szse,2238028258812047360,2026-04-04,2026-04-22,董秘您好，请问截止到2026年3月31日公司股东人数是多少？谢谢！,感谢您的关注！截至2026年3月31日的股东人数，敬请关注公司拟于2026年4月30日在指定媒体发布的2026年第一季度报告。,substantive,unclassified,official interaction without a mapped investable theme,manual review required,higher-official-signal,https://irm.cninfo.com.cn/ircs/question/questionDetail?questionId=2238028258812047360,cninfo_irm
000426.SZ,szse,2237242288386813952,2026-04-03,2026-04-22,董秘您好，能否介绍下，公司26年-29年的白银和锡的产能规划？谢谢,感谢您的关注！公司各年度产量数据，敬请关注公司在指定信息披露媒体发布的定期报告。,substantive,unclassified,official interaction without a mapped investable theme,manual review required,higher-official-signal,https://irm.cninfo.com.cn/ircs/question/questionDetail?questionId=2237242288386813952,cninfo_irm
000426.SZ,szse,2236315898266415104,2026-04-01,2026-04-07,请问:截止3月31号公司的股东人数是多少！谢谢？,感谢您的关注！截至2026年3月31日的股东人数，敬请关注公司拟于2026年4月30日在指定媒体发布的2026年第一季度报告。,substantive,unclassified,official interaction without a mapped investable theme,manual review required,higher-official-signal,https://irm.cninfo.com.cn/ircs/question/questionDetail?questionId=2236315898266415104,cninfo_irm
000426.SZ,szse,2235879684242354176,2026-04-01,2026-04-07,董秘您好，贵公司会公布一季度业绩增长预告吗？,感谢您的关注！公司将严格按照信息披露规则，根据实际情况履行信息披露义务，如有相关安排将按规定及时公告。,substantive,unclassified,official interaction without a mapped investable theme,manual review required,higher-official-signal,https://irm.cninfo.com.cn/ircs/question/questionDetail?questionId=2235879684242354176,cninfo_irm
000426.SZ,szse,2235629313384411136,2026-03-31,2026-04-07,请问，3月末股东人数是多少？谢谢·,感谢您的关注！截至2026年3月31日的股东人数，敬请关注公司拟于2026年4月30日在指定媒体发布的2026年第一季度报告。,substantive,unclassified,official interaction without a mapped investable theme,manual review required,higher-official-signal,https://irm.cninfo.com.cn/ircs/question/questionDetail?questionId=2235629313384411136,cninfo_irm
000426.SZ,szse,2232038832576245760,2026-03-27,2026-04-03,"尊敬的董秘，您好！近期公司股价持续下跌，投资者高度关切核心资产进度：
1.银漫二期目前审批、开工及投产最新进展？产能增量何时落地？
2.宇邦矿业825万吨扩产手续有无卡点，何时能开工、达产？
3.当年承诺注入的布敦银根矿，探转采、投产进度如何？能否明确资产注入具体时间表，保障中小股东权益？盼详细明确回复。",感谢您的关注！1、目前，银漫二期、宇邦矿业825万吨扩建项目正在推进办理开工许可手续工作。2、目前，兴业集团已将布敦银根委托上市公司托管经营，布敦银根297万吨/年地下采选项目已取得立项批复，暂无具体注入时间表。,directional-but-unquantified,unclassified,official interaction without a mapped investable theme,manual review required,medium-official-signal,https://irm.cninfo.com.cn/ircs/question/questionDetail?questionId=2232038832576245760,cninfo_irm
000426.SZ,szse,2231990050131857408,2026-03-27,2026-04-03,兴业银锡2.94亿收购的铜都矿业49%股权，此前未减值，2024年12月却减值至1.7亿出售给关联方鸿升建筑，且铜都矿业新获采矿权、负债超2亿。交易未经董事会，仅总经理办公会审议，未披露尽调及减值依据，程序合规性存疑，总经理办公会无权决定重大资产出售。,感谢您的关注！1、公司于2018年以2.94亿元收购铜都矿业49%股权，并支付审计、评估等相关费用81万元，该项长期股权投资初始成本合计为2.95亿元，后续采用权益法进行核算。自投资以来，铜都矿业持续处于亏损状态，公司按权益法累计确认投资损失0.36亿元。为审慎、公允反映该项股权投资价值，公司每年聘请评估机构进行减值测试，并于2022年、2023年及2024年分别计提减值准备0.06亿元、0.38亿元和0.48亿元，累计计提0.91亿元。综上，公司所持铜都矿业49%股权的账面价值为1.68亿元。2、公司本次转让铜都矿业49%股权事项，严格按照《公司章程》及相关制度规定的决策权限执行，该事项属于总经理办公会审议权限范围，未达到需提交董事会审议的标准，决策程序合法合规。,substantive,capital-allocation,capital-allocation quality narrative,needs realized return history or portfolio evidence,higher-official-signal,https://irm.cninfo.com.cn/ircs/question/questionDetail?questionId=2231990050131857408,cninfo_irm
000426.SZ,szse,2230624302277177344,2026-03-25,2026-04-01,请问，截至2026年3月 20日公司的股东总数是多少？谢谢,"感谢您的关注！根据中登公司深圳分公司提供的数据，截至2026年3月20日，公司在册股东总户数为180,228户。",substantive,unclassified,official interaction without a mapped investable theme,manual review required,higher-official-signal,https://irm.cninfo.com.cn/ircs/question/questionDetail?questionId=2230624302277177344,cninfo_irm
000426.SZ,szse,2229065667235393536,2026-03-23,2026-03-27,请问，3月20日股东人数是多少？谢谢,"感谢您的关注！根据中登公司深圳分公司提供的数据，截至2026年3月20日，公司在册股东总户数为180,228户。",substantive,unclassified,official interaction without a mapped investable theme,manual review required,higher-official-signal,https://irm.cninfo.com.cn/ircs/question/questionDetail?questionId=2229065667235393536,cninfo_irm
000426.SZ,szse,2223989007333175296,2026-03-16,2026-03-23,银漫矿业25年上半年矿产银和矿产锡的产量为多少吨？,感谢您的关注！公司生产的各产品产量，敬请查阅公司在指定媒体发布的定期报告。,non-committal,unclassified,official interaction without a mapped investable theme,manual review required,weak-official-signal,https://irm.cninfo.com.cn/ircs/question/questionDetail?questionId=2223989007333175296,cninfo_irm
000426.SZ,szse,2223856017819123712,2026-03-16,2026-03-16,董秘你好，请问截止3月10日的股东人数，谢谢,"感谢您的关注！根据中登公司深圳分公司提供的数据，截至2026年3月10日，公司在册股东总户数为197,003户。",substantive,unclassified,official interaction without a mapped investable theme,manual review required,higher-official-signal,https://irm.cninfo.com.cn/ircs/question/questionDetail?questionId=2223856017819123712,cninfo_irm
000426.SZ,szse,2221734226812186624,2026-03-13,2026-03-16,董秘您好，请问截至3月10日公司的股东人数是多少？谢谢,"感谢您的关注！根据中登公司深圳分公司提供的数据，截至2026年3月10日，公司在册股东总户数为197,003户。",substantive,unclassified,official interaction without a mapped investable theme,manual review required,higher-official-signal,https://irm.cninfo.com.cn/ircs/question/questionDetail?questionId=2221734226812186624,cninfo_irm
000426.SZ,szse,2219782945726164992,2026-03-10,2026-03-16,董秘您好！我想查询截至2026年3月10日公司最新股东人数？谢谢,"感谢您的关注！根据中登公司深圳分公司提供的数据，截至2026年3月10日，公司在册股东总户数为197,003户。",substantive,unclassified,official interaction without a mapped investable theme,manual review required,higher-official-signal,https://irm.cninfo.com.cn/ircs/question/questionDetail?questionId=2219782945726164992,cninfo_irm
000426.SZ,szse,2219491386166243328,2026-03-10,2026-03-16,公司领导您好！请问截止2026年3月10日，公司股东人数是多少户？感谢您的回复！,"感谢您的关注！根据中登公司深圳分公司提供的数据，截至2026年3月10日，公司在册股东总户数为197,003户。",substantive,unclassified,official interaction without a mapped investable theme,manual review required,higher-official-signal,https://irm.cninfo.com.cn/ircs/question/questionDetail?questionId=2219491386166243328,cninfo_irm
000426.SZ,szse,2218693432782254080,2026-03-09,2026-03-16,董秘你好：公司各矿采矿许可证范围内铟金属保有储量为1130.7吨，目前铟金属价格持续高位，公司是否有单独提炼销售铟金属的计划？目前公司矿石中的铟是如何处置的？,感谢您的关注！目前铟金属主要富集在锌精矿中，未有单独提炼的计划。,non-committal,unclassified,official interaction without a mapped investable theme,manual review required,weak-official-signal,https://irm.cninfo.com.cn/ircs/question/questionDetail?questionId=2218693432782254080,cninfo_irm
000426.SZ,szse,2215728281837715456,2026-03-05,2026-03-16,请问截止2月28日，公司股东人数是多少？,"感谢您的关注！根据中登公司深圳分公司提供的数据，截至2026年2月27日，公司在册股东总户数为193,227户。",substantive,unclassified,official interaction without a mapped investable theme,manual review required,higher-official-signal,https://irm.cninfo.com.cn/ircs/question/questionDetail?questionId=2215728281837715456,cninfo_irm
000426.SZ,szse,2214403593677205504,2026-03-03,2026-03-05,董秘新年好，能否介绍下公司银漫2期和宇邦扩产的进展情况？,感谢您的关注！1、银漫二期目前已取得立项批复，正在积极与当地政府沟通，推进办理开工许可手续工作。2、宇邦矿业年采选 825万吨扩建工程，目前正在办理开工许可手续，取得开工许可后即可开工建设。,directional-but-unquantified,unclassified,official interaction without a mapped investable theme,manual review required,medium-official-signal,https://irm.cninfo.com.cn/ircs/question/questionDetail?questionId=2214403593677205504,cninfo_irm
000426.SZ,szse,2213519758127165440,2026-03-02,2026-03-05,你好，截止2月27日收盘，公司最新的股东人数是多少,"感谢您的关注！根据中登公司深圳分公司提供的数据，截至2026年2月27日，公司在册股东总户数为193,227户。",substantive,unclassified,official interaction without a mapped investable theme,manual review required,higher-official-signal,https://irm.cninfo.com.cn/ircs/question/questionDetail?questionId=2213519758127165440,cninfo_irm
000426.SZ,szse,2212833173232500736,2026-03-01,2026-03-05,尊敬的董秘，您好！根据公司2019年公布的银漫矿业资源储量核实报告，银漫矿业有24万吨钼金属推测量，且品位0.04，已接近工业选矿标准。钼是军工金属，利润高，弹性大。请问公司有没有可能考虑花少量的投入，请相关矿冶院校或科研机构立项，看能否找到好的选矿工艺技术，以便将之开发岀来，作为未来的一个利润增长点？,感谢您的关注！目前，银漫矿业未有钼金属。,non-committal,unclassified,official interaction without a mapped investable theme,manual review required,weak-official-signal,https://irm.cninfo.com.cn/ircs/question/questionDetail?questionId=2212833173232500736,cninfo_irm
000426.SZ,szse,2211929744149254144,2026-02-28,2026-03-05,董秘您好！我想查询截至2026年2月27日公司最新股东人数？谢谢,"感谢您的关注！根据中登公司深圳分公司提供的数据，截至2026年2月27日，公司在册股东总户数为193,227户。",substantive,unclassified,official interaction without a mapped investable theme,manual review required,higher-official-signal,https://irm.cninfo.com.cn/ircs/question/questionDetail?questionId=2211929744149254144,cninfo_irm
000426.SZ,szse,2211586215345061888,2026-02-27,2026-03-05,你好，请问公司大部份产品出售定价是长期协议价吗?一般是多长时间重新协议一次?,感谢您的关注！公司产品定价采取随行就市原则；协议签定根据市场价格变化和产量等以补充协议方式随时调整。,substantive,unclassified,official interaction without a mapped investable theme,manual review required,higher-official-signal,https://irm.cninfo.com.cn/ircs/question/questionDetail?questionId=2211586215345061888,cninfo_irm
000426.SZ,szse,2210489031768260608,2026-02-26,2026-03-05,公司的铟储量多少，每年产量多少吨,感谢您的关注！截至2024年末，公司各矿采矿许可证范围内铟金属保有储量为1130.7吨（截至2025年末数据，敬请关注公司拟于2026年4月1日在指定媒体发布的2025年年度报告）；截至目前，公司未单独生产铟金属。,substantive,unclassified,official interaction without a mapped investable theme,manual review required,higher-official-signal,https://irm.cninfo.com.cn/ircs/question/questionDetail?questionId=2210489031768260608,cninfo_irm
000426.SZ,szse,2209208306841620480,2026-02-24,2026-03-04,董秘您好，请问贵公司2026年2月13日股东人数是多少？谢谢,"感谢您的关注！根据中登公司深圳分公司提供的数据，截至2026年2月13日，公司在册股东总户数为173,210户。",substantive,unclassified,official interaction without a mapped investable theme,manual review required,higher-official-signal,https://irm.cninfo.com.cn/ircs/question/questionDetail?questionId=2209208306841620480,cninfo_irm
000426.SZ,szse,2204570257418027008,2026-02-18,2026-03-04,请问最新一期公司的股东人数是多少？谢谢,"感谢您的关注！根据中登公司深圳分公司提供的数据，截至2026年2月13日，公司在册股东总户数为173,210户。",substantive,unclassified,official interaction without a mapped investable theme,manual review required,higher-official-signal,https://irm.cninfo.com.cn/ircs/question/questionDetail?questionId=2204570257418027008,cninfo_irm
000426.SZ,szse,2196782708616265728,2026-02-07,2026-02-27,在最近30天内，即1月10日至2月10日，兴业银锡有没有在上海期货交易所及美国CME及伦敦金属交易所做黄金与白银及铜的卖出套期保值合约，套期保值的头寸是多少，截止目前是亏还是盈利,感谢您的关注！2026年初至目前，公司未开展黄金、白银、铜的套期保值业务。,non-committal,unclassified,official interaction without a mapped investable theme,manual review required,weak-official-signal,https://irm.cninfo.com.cn/ircs/question/questionDetail?questionId=2196782708616265728,cninfo_irm
000426.SZ,szse,2196782184770244608,2026-02-07,2026-02-27,在最近30天内，即1月10日至2月10日，兴业银锡有没有在上海期货交易所及美国CME及伦敦金属交易所做黄金与白银及铜的卖出套期保值合约，套期保值的头寸是多少，截止目前是亏还是盈利，可以覆盖本次黄金白银及铜的下跌吗？,感谢您的关注！2026年初至目前，公司未开展黄金、白银、铜的套期保值业务。,non-committal,unclassified,official interaction without a mapped investable theme,manual review required,weak-official-signal,https://irm.cninfo.com.cn/ircs/question/questionDetail?questionId=2196782184770244608,cninfo_irm
000426.SZ,szse,2168626818779897856,2025-12-31,2026-02-27,请问贵司是目前亚洲白银储量最多的企业吗？谢谢,感谢您的关注！目前暂无国际权威机构对公司白银储量进行明确的官方排名。,non-committal,unclassified,official interaction without a mapped investable theme,manual review required,weak-official-signal,https://irm.cninfo.com.cn/ircs/question/questionDetail?questionId=2168626818779897856,cninfo_irm
000426.SZ,szse,2166780798863155200,2025-12-29,2026-02-27,公司是亚洲白银储量第一的中国企业吗？公司白银储量排在世界第几位?,感谢您的关注！目前暂无国际权威机构对公司白银储量进行明确的官方排名。,non-committal,unclassified,official interaction without a mapped investable theme,manual review required,weak-official-signal,https://irm.cninfo.com.cn/ircs/question/questionDetail?questionId=2166780798863155200,cninfo_irm
