ts_code,exchange,question_id,question_time,answer_time,question,answer,answer_class,theme,story_read,proof_needed,credibility,source_url,source_type
001309.SZ,szse,2251295559142055936,2026-04-22,2026-04-27,董秘，市场存储芯片短缺，价格持续攀升，公司有囤货压货行为嘛？公司产能利用率怎么样？二季度是否保持高速增长？,感谢您的关注！公司整体库存策略以业务发展需要为指引，结合客户需求和市场变化进行动态调整，不存在囤货压货行为。目前公司产能利用率处于合理水平，能够有效保障客户订单交付。关于公司二季度的具体经营情况，请您关注公司后续披露的定期报告。,substantive,unclassified,official interaction without a mapped investable theme,manual review required,higher-official-signal,https://irm.cninfo.com.cn/ircs/question/questionDetail?questionId=2251295559142055936,cninfo_irm
001309.SZ,szse,2249874732420931584,2026-04-20,2026-04-27,请问：4月20日的股东人数？谢谢,感谢您的关注！截至2026年4月20日公司含信用账户合并股东名册的股东数为63110户。,substantive,unclassified,official interaction without a mapped investable theme,manual review required,higher-official-signal,https://irm.cninfo.com.cn/ircs/question/questionDetail?questionId=2249874732420931584,cninfo_irm
001309.SZ,szse,2237327535344672768,2026-04-03,2026-04-27,您好！太空算力方面需要抗辐射的存储产品公司能不能做？,感谢您的关注！您所提及的方向尚处早期探索阶段，公司暂未布局相关产品。公司在存储主控芯片、固件及存储解决方案方面具备自主研发能力，相关技术与品广泛应用于数据中心、消费电子、工业控制、智能终端等领域。,directional-but-unquantified,compute-power,new-demand adjacency around power + computing infrastructure,"needs revenue, order, or project economics before valuation uplift",medium-official-signal,https://irm.cninfo.com.cn/ircs/question/questionDetail?questionId=2237327535344672768,cninfo_irm
001309.SZ,szse,2218840131953651712,2026-03-09,2026-04-27,近期OpenClaw热度较高，各地也陆续出台＂龙虾＂扶持政策，请问贵公司的产品是否适用于＂龙虾盒子＂等设备？,感谢您的关注！公司作为专业存储控制芯片及解决方案提供商，产品广泛应用于数据中心、消费电子、工业控制、智能终端等领域。公司未直接涉及您提及的相关设备，关于公司产品的具体应用情况，请以公司在指定信息披露媒体发布的正式公告为准。,non-committal,compute-power,new-demand adjacency around power + computing infrastructure,"needs revenue, order, or project economics before valuation uplift",weak-official-signal,https://irm.cninfo.com.cn/ircs/question/questionDetail?questionId=2218840131953651712,cninfo_irm
001309.SZ,szse,2242465329664438272,2026-04-10,2026-04-17,请问：4月10日的股东人数？谢谢,感谢您的关注！截至2026年4月10日公司含信用账户合并股东名册的股东数为55715户。,substantive,unclassified,official interaction without a mapped investable theme,manual review required,higher-official-signal,https://irm.cninfo.com.cn/ircs/question/questionDetail?questionId=2242465329664438272,cninfo_irm
001309.SZ,szse,2237003883789115392,2026-04-02,2026-04-14,你好董秘  贵公司有没有规划发行股份收购公司 打造全产业链盈利能力进一步提高,感谢您的关注！公司始终深耕存储主业，密切关注产业链上下游的优质发展机遇，持续优化产业布局，相关重大事项请以公司在指定信息披露媒体发布的正式公告为准。,non-committal,unclassified,official interaction without a mapped investable theme,manual review required,weak-official-signal,https://irm.cninfo.com.cn/ircs/question/questionDetail?questionId=2237003883789115392,cninfo_irm
001309.SZ,szse,2236119472534925312,2026-04-01,2026-04-14,公司大股东及董监高团队未来是否有进一步减持计划，烦请告知,感谢您的关注！截至目前，公司未收到大股东及董监高团队关于未来减持计划的相关通知，若后续涉及相关事项，公司将严格按照法律法规及监管部门的要求，及时履行信息披露义务。,substantive,unclassified,official interaction without a mapped investable theme,manual review required,higher-official-signal,https://irm.cninfo.com.cn/ircs/question/questionDetail?questionId=2236119472534925312,cninfo_irm
001309.SZ,szse,2235325822886699008,2026-03-31,2026-04-14,你好董秘，公司公布的一季度业绩预告盈利爆发增长，请问是这种增长是否具有可持续性？近期看到有媒体报道说存储价格下跌了，请问是否属实？,感谢您的关注！一季度业绩的快速增长，除行业景气度外，也极大得益于公司前期在企业级、嵌入式以及国产化等方向上的前瞻性布局。AI推理应用落地加速为存储行业带来长期、广阔的市场空间，2025年三季度以来行业景气度持续上行。现货市场价格波动主要受短期订单、市场情绪及阶段性补库行为影响，呈现较强的短期波动特征；而合约市场价格走势、行业中长期供需格局，更能真实、客观地反映行业长期发展趋势。市场机构TrendForce集邦咨询预估2026年第二季度一般型DRAM合约价格季增58-63%，NAND Flash合约价格季增70-75%。公司未来将持续深耕主营业务，不断提升核心竞争力与经营质量，具体业绩情况请以公司在指定信息披露媒体发布的定期报告及相关公告为准。,non-committal,unclassified,official interaction without a mapped investable theme,manual review required,weak-official-signal,https://irm.cninfo.com.cn/ircs/question/questionDetail?questionId=2235325822886699008,cninfo_irm
001309.SZ,szse,2235268364814213120,2026-03-31,2026-04-14,公司股价已偏高，一季度财报多少，不及预期恐怕杀跌，行业存储芯片涨价，公司发展空间多大，,"感谢您的关注！公司已于近期披露了2026年第一季度业绩预告，预计实现营业收入730,000万元–780,000万元，实现归属于上市公司股东的净利润315,000万元–365,000万元，盈利能力持续改善。AI推理应用落地加速为存储行业带来长期、广阔的市场空间，2025年三季度以来行业景气度持续上行，公司将密切关注存储芯片行业市场动态与发展趋势，持续深耕存储主业，不断优化产品结构与市场布局，紧抓行业发展机遇提升核心竞争力与经营质量。公司股价受宏观经济、市场环境、行业周期、投资者情绪等多重因素综合影响，敬请广大投资者理性投资、注意投资风险。",substantive,unclassified,official interaction without a mapped investable theme,manual review required,higher-official-signal,https://irm.cninfo.com.cn/ircs/question/questionDetail?questionId=2235268364814213120,cninfo_irm
001309.SZ,szse,2235145245281705984,2026-03-31,2026-04-14,人美心善的董秘好，近期存储行业迎来了两个利空，谷歌发布的内存压缩新技术论文使市场觉得AI存储需求会下降、华强北消费级存储芯片价格有所回落，从公司当前和未来一段时间内的经营预测和行业发展情况来看，存储行业真的要周期回落了？还是说近期市场的回调是资金的误判？公司是否仍如前期对外交流的那样，仍在供不应求的存储市场下高速增长，助力国产替代并持续提升经营业绩，谢谢！,"感谢您的关注！市场机构TrendForce集邦咨询预估2026年第二季度一般型DRAM合约价格季增58-63%，NAND Flash合约价格季增70-75%。AI推理应用落地加速也将为存储行业带来长期、广阔的市场空间与增长机遇。相关技术尚处于应用早期，公司将持续保持关注。公司产品布局覆盖数据中心、消费电子、工控安防、通信电力等多个应用领域，具备完善的供应链管理体系与市场风险应对能力，能够灵活应对市场环境变化。公司已于近期披露了2026年第一季度业绩预告，预计实现营业收入730,000万元–780,000万元，实现归属于上市公司股东的净利润315,000万元–365,000万元，盈利能力持续改善，二级市场股价受多重因素影响存在波动，请您注意投资风险。",substantive,compute-power,new-demand adjacency around power + computing infrastructure,"needs revenue, order, or project economics before valuation uplift",higher-official-signal,https://irm.cninfo.com.cn/ircs/question/questionDetail?questionId=2235145245281705984,cninfo_irm
001309.SZ,szse,2233996564689793024,2026-03-29,2026-04-14,尊敬的董秘您好，我是贵公司的一名投资者，近期市场传闻dram及ssd价格出现下跌回调现象，请问本次回调是否会对贵公司晶圆存货现值产生巨大波动影响，贵公司在hbm方向是否有一定布局？,感谢您的关注！现货市场价格波动主要受短期订单、市场情绪及阶段性补库行为影响，呈现较强的短期波动特征；而合约市场价格走势、行业中长期供需格局，更能真实、客观地反映行业长期发展趋势。市场机构TrendForce集邦咨询预估2026年第二季度一般型DRAM合约价格季增58-63%，NAND Flash合约价格季增70-75%。公司已建立完善的库存管理机制与存货跌价准备计提制度，严格按照企业会计准则对存货进行规范核算与管理，目前整体库存规模与结构处于安全可控的良性运营状态，相关市场价格波动对公司的具体影响敬请关注公司后续定期报告。公司始终紧密跟踪AI、云计算等新兴技术对存储产品的多样化需求，结合公司实际情况加快对CXL、新型存储介质等前沿技术的探索与研发，HBM领域暂无实际布局落地。,substantive,unclassified,official interaction without a mapped investable theme,manual review required,higher-official-signal,https://irm.cninfo.com.cn/ircs/question/questionDetail?questionId=2233996564689793024,cninfo_irm
001309.SZ,szse,2221587725599457280,2026-03-13,2026-04-14,董秘您好，英伟达发布的Rubin新架构采用了HBM4，贵公司曾在互动平台表示会对HBM技术保持持续关注和布局，请问目前贵公司在HBM领域是否有实际的布局落地？,感谢您的关注！公司始终紧密跟踪AI、云计算等新兴技术对存储产品的多样化需求，结合公司实际情况加快对PCIe、CXL、新型存储介质等前沿技术的探索与研发，HBM领域暂无实际布局落地。未来公司将结合自身技术规划及市场需求，适时评估相关技术的布局机会，持续提升在存储领域的综合竞争力。,directional-but-unquantified,unclassified,official interaction without a mapped investable theme,manual review required,medium-official-signal,https://irm.cninfo.com.cn/ircs/question/questionDetail?questionId=2221587725599457280,cninfo_irm
001309.SZ,szse,2310711827507474432,2026-07-11,,长鑫上市对公司今后的发展有促进作用吗？,,unanswered,unclassified,official interaction without a mapped investable theme,manual review required,no-company-signal,https://irm.cninfo.com.cn/ircs/question/questionDetail?questionId=2310711827507474432,cninfo_irm
001309.SZ,szse,2310217193194639360,2026-07-10,,请问截止7/10日的股东人数谢谢,,unanswered,unclassified,official interaction without a mapped investable theme,manual review required,no-company-signal,https://irm.cninfo.com.cn/ircs/question/questionDetail?questionId=2310217193194639360,cninfo_irm
001309.SZ,szse,2310144213110345728,2026-07-10,,尊敬的董秘，请问截止到2026年7月10日，贵司的股东数量是多少？谢谢！,,unanswered,unclassified,official interaction without a mapped investable theme,manual review required,no-company-signal,https://irm.cninfo.com.cn/ircs/question/questionDetail?questionId=2310144213110345728,cninfo_irm
001309.SZ,szse,2309928726120394752,2026-07-10,,请问董秘，公司光明基地投产运行后，生产是否正常，产能爬坡情况是否符合预期？,,unanswered,unclassified,official interaction without a mapped investable theme,manual review required,no-company-signal,https://irm.cninfo.com.cn/ircs/question/questionDetail?questionId=2309928726120394752,cninfo_irm
001309.SZ,szse,2304305445582376960,2026-07-02,,什么时候预告中报业绩,,unanswered,unclassified,official interaction without a mapped investable theme,manual review required,no-company-signal,https://irm.cninfo.com.cn/ircs/question/questionDetail?questionId=2304305445582376960,cninfo_irm
001309.SZ,szse,2304130803618402304,2026-07-02,,董秘你好，请问贵公司打算什么预报公司2026年度半年报，谢谢！,,unanswered,unclassified,official interaction without a mapped investable theme,manual review required,no-company-signal,https://irm.cninfo.com.cn/ircs/question/questionDetail?questionId=2304130803618402304,cninfo_irm
001309.SZ,szse,2303418371626995712,2026-07-01,,已经两天大幅度回调了，什么时候公布中报预告？,,unanswered,unclassified,official interaction without a mapped investable theme,manual review required,no-company-signal,https://irm.cninfo.com.cn/ircs/question/questionDetail?questionId=2303418371626995712,cninfo_irm
001309.SZ,szse,2303346765932236800,2026-07-01,,您好，打扰了。按照证券相关条例，同比扭亏为盈或者同比盈利高，需要预告。请问贵公司的中报是否会进行预告呢？,,unanswered,unclassified,official interaction without a mapped investable theme,manual review required,no-company-signal,https://irm.cninfo.com.cn/ircs/question/questionDetail?questionId=2303346765932236800,cninfo_irm
001309.SZ,szse,2302682102559526912,2026-06-30,,尊敬的董秘您好，请问贵公司今年赚了这么多钱，是否会向晶圆或者技术壁垒更高的方向上发展？,,unanswered,unclassified,official interaction without a mapped investable theme,manual review required,no-company-signal,https://irm.cninfo.com.cn/ircs/question/questionDetail?questionId=2302682102559526912,cninfo_irm
001309.SZ,szse,2301204590861750272,2026-06-28,,董秘您好，光明智能制造基地聚焦AI企业级、车载高端存储已于5月投产，想咨询目前基地产能爬坡进度，Q3产能利用率预期，对应高端存储产品是否已批量供货算力、云厂商客户，基地产能持续释放后下半年高端业务占比与整体毛利率是否会得到明显提振？谢谢,,unanswered,compute-power,new-demand adjacency around power + computing infrastructure,"needs revenue, order, or project economics before valuation uplift",no-company-signal,https://irm.cninfo.com.cn/ircs/question/questionDetail?questionId=2301204590861750272,cninfo_irm
001309.SZ,szse,2296592096733343744,2026-06-22,2026-06-26,请问贵司，截止到6月20日，贵司的股东人数是多少？,感谢您的关注！截至2026年6月18日公司含信用账户合并股东名册的股东数为105063户。,substantive,unclassified,official interaction without a mapped investable theme,manual review required,higher-official-signal,https://irm.cninfo.com.cn/ircs/question/questionDetail?questionId=2296592096733343744,cninfo_irm
001309.SZ,szse,2293728126686019584,2026-06-18,2026-06-26,请问贵公司是否会在6月公布上半年业绩预告？,感谢您的关注！根据深交所相关规定，若公司半年度业绩达到业绩预告披露标准，将在半年度结束之日起十五日内依法履行信息披露义务，敬请留意公司在法定信息披露媒体发布的相关公告。,directional-but-unquantified,unclassified,official interaction without a mapped investable theme,manual review required,medium-official-signal,https://irm.cninfo.com.cn/ircs/question/questionDetail?questionId=2293728126686019584,cninfo_irm
001309.SZ,szse,2292504318795268096,2026-06-16,2026-06-26,董秘您好，当前全球存储行业上下游普遍推行 LTA 长期锁量锁价供货长约，以此平抑周期价格波动、保障订单稳定交付。想咨询下：公司目前是否有与下游终端、品牌、工控类等大客户签署长期供货框架协议或正式 LTA 长约？保密原则不需要您公布客户名称。,感谢您的关注！公司与下游各领域核心客户保持长期稳定的业务合作，持续深化协同以保障订单稳定交付、平抑行业周期波动影响。相关商务合作细节涉及商业机密，具体条款不便披露。如相关事项达到信息披露标准，公司将严格按照监管要求及时履行信息披露义务。,substantive,unclassified,official interaction without a mapped investable theme,manual review required,higher-official-signal,https://irm.cninfo.com.cn/ircs/question/questionDetail?questionId=2292504318795268096,cninfo_irm
001309.SZ,szse,2291953368980471808,2026-06-15,2026-06-26,你好。咨询下截止最近可查日期。或6月10号的股东数量,感谢您的关注！截至2026年6月10日公司含信用账户合并股东名册的股东数为95568户。,substantive,unclassified,official interaction without a mapped investable theme,manual review required,higher-official-signal,https://irm.cninfo.com.cn/ircs/question/questionDetail?questionId=2291953368980471808,cninfo_irm
001309.SZ,szse,2291034177259651072,2026-06-14,2026-06-26,你好，问一下截止2026年6月12号，公司股东人数是多少,感谢您的关注！截至2026年6月10日公司含信用账户合并股东名册的股东数为95568户。,substantive,unclassified,official interaction without a mapped investable theme,manual review required,higher-official-signal,https://irm.cninfo.com.cn/ircs/question/questionDetail?questionId=2291034177259651072,cninfo_irm
001309.SZ,szse,2290170828703612928,2026-06-13,2026-06-26,"您好，公司此前披露企业级SSD已进入国内头部互联网、服务器厂商供应链，同时自研企业级主控H3361正式发布。想咨询两个问题：
1、截至目前通过国内头部云厂商整机认证的SSD具体型号有哪些，上半年企业级业务营收占比是否进一步提升？北美相关客户认证及订单项目现阶段推进节奏如何？
2、自研H3361主控已落地哪些厂商兼容性认证，是否实现批量装机",感谢您的关注！公司企业级存储产品已成功进入多家头部互联网厂商、服务器厂商供应链并实现规模销售，企业级业务正处于加速扩张阶段，收入规模及收入占比均在持续提升。具体产品型号、客户认证及订单等细节信息，涉及公司商业机密，不便在此披露，相关信息请以公司在法定信息披露媒体发布的公告为准。,non-committal,unclassified,official interaction without a mapped investable theme,manual review required,weak-official-signal,https://irm.cninfo.com.cn/ircs/question/questionDetail?questionId=2290170828703612928,cninfo_irm
001309.SZ,szse,2288619460486348800,2026-06-11,2026-06-26,请问6月10日股东人数是多少？谢谢！,感谢您的关注！截至2026年6月10日公司含信用账户合并股东名册的股东数为95568户。,substantive,unclassified,official interaction without a mapped investable theme,manual review required,higher-official-signal,https://irm.cninfo.com.cn/ircs/question/questionDetail?questionId=2288619460486348800,cninfo_irm
001309.SZ,szse,2282589094474530816,2026-06-03,2026-06-26,董秘您好，公司一季报显示合同负债高达13.34亿元，创下历史新高。请问这些预收账款中，主要是否来源于服务器及数据中心客户对企业级SSD/高阶存储产品的锁定订单？这部分订单预计会在二季度还是下半年集中转化为实际营收？感谢回复！,感谢您的关注！公司2026年第一季度报告显示，报告期末合同负债为13.34亿元，主要系预收货款增加所致。合同负债系公司已收客户对价而应向客户转让商品的义务，后续将随产品交付逐步确认为收入，相关具体业务信息请以公司在法定信息披露媒体发布的公告为准。,non-committal,compute-power,new-demand adjacency around power + computing infrastructure,"needs revenue, order, or project economics before valuation uplift",weak-official-signal,https://irm.cninfo.com.cn/ircs/question/questionDetail?questionId=2282589094474530816,cninfo_irm
001309.SZ,szse,2281334405876768768,2026-06-01,2026-06-09,请问德明利有企业级AI服务器/数据中心存储芯片产品吗？相关产品增长率如何？公司一季度总营收多少，一季度末总存货多少？二季度存储芯片价格，在一季度基础上，是否环比上涨？,感谢您的关注！公司围绕 AI 数据中心与智算场景，构建了覆盖 PCIe/SATA 企业级SSD及RDIMM等相关产品布局，相关业务收入稳定增长。2026 年第一季度公司实现营业收入75.38亿元，截至2026年3月31日公司存货余额为121.92亿元。关于存储价格，根据 TrendForce 集邦咨询报告，预估2026年第二季度一般型 DRAM 合约价格季增58-63%，NAND Flash 合约价格季增70-75%。最新价格情况，您可通过查阅相关媒体报道、行业垂直机构报告等方式了解跟踪。,substantive,compute-power,new-demand adjacency around power + computing infrastructure,"needs revenue, order, or project economics before valuation uplift",higher-official-signal,https://irm.cninfo.com.cn/ircs/question/questionDetail?questionId=2281334405876768768,cninfo_irm
001309.SZ,szse,2281001073464926208,2026-06-01,2026-06-09,公司股本小，市值在同行最低，容易给人造成股价太高的错觉。建议公司中期大比例送股或公积金转赠股本。,感谢您的关注！您的建议已收悉，公司高度重视全体股东回报，公司利润分配方案将结合实际经营情况、未来发展战略、股东回报规划及相关法律法规要求综合审慎研究制定，相关信息请以公司公告为准。,non-committal,unclassified,official interaction without a mapped investable theme,manual review required,weak-official-signal,https://irm.cninfo.com.cn/ircs/question/questionDetail?questionId=2281001073464926208,cninfo_irm
001309.SZ,szse,2281846091100545024,2026-06-02,2026-06-04,"今年一季度,我国集成电路出口724.7亿美元,同比增长77.5%,其中存储器产品出口459.9亿美元,同比增长174.2%。跟去年3月份相比,存储器价格涨幅已经达到将近十倍到十几倍。国产品牌价格,跟海外品牌有较大价差,价格很有竞争力。集邦咨询大幅上调全球存储器产值预估，预计2027年全球存储器产值将扩大至1.28万亿美元，而此前预计为8427亿美元。请问德明利出口业绩占比是多少？出口增长率大吗？",感谢您的关注！公司通过中国香港地区的物流、贸易平台辐射全球客户，2025年度外销收入占比为64.08%，同比增长107.72%，具体销量及外销数据请查阅公司往期定期报告。,substantive,unclassified,official interaction without a mapped investable theme,manual review required,higher-official-signal,https://irm.cninfo.com.cn/ircs/question/questionDetail?questionId=2281846091100545024,cninfo_irm
001309.SZ,szse,2281752555124228096,2026-06-02,2026-06-04,请问截止2026年5月29日，公司股东人数是多少？,感谢您的关注！截至2026年5月29日公司含信用账户合并股东名册的股东数为99252户。,substantive,unclassified,official interaction without a mapped investable theme,manual review required,higher-official-signal,https://irm.cninfo.com.cn/ircs/question/questionDetail?questionId=2281752555124228096,cninfo_irm
001309.SZ,szse,2279760566472212480,2026-05-30,2026-06-04,预估第二季度财报会比一季度财报增长吗？,感谢您的关注！根据深交所相关规定，若公司半年度业绩达到业绩预告披露标准，将在半年度结束之日起十五日内依法履行信息披露义务，敬请留意公司在法定信息披露媒体发布的相关公告。,directional-but-unquantified,unclassified,official interaction without a mapped investable theme,manual review required,medium-official-signal,https://irm.cninfo.com.cn/ircs/question/questionDetail?questionId=2279760566472212480,cninfo_irm
001309.SZ,szse,2279488652072828928,2026-05-30,2026-06-04,请问公司订单排充是吗？,感谢您的关注！目前公司在手订单充足，公司将结合市场整体情况及下游订单情况进行合理排产，具体经营情况请以公司在法定信息披露媒体发布的公告为准。,non-committal,unclassified,official interaction without a mapped investable theme,manual review required,weak-official-signal,https://irm.cninfo.com.cn/ircs/question/questionDetail?questionId=2279488652072828928,cninfo_irm
001309.SZ,szse,2279093515280015360,2026-05-29,2026-06-04,请问公司的产品有出口吗。销量如何。,感谢您的关注！公司通过中国香港地区的物流、贸易平台辐射全球客户，2025年度外销收入占比为64.08%，具体销量及外销数据请查阅公司往期定期报告。,substantive,unclassified,official interaction without a mapped investable theme,manual review required,higher-official-signal,https://irm.cninfo.com.cn/ircs/question/questionDetail?questionId=2279093515280015360,cninfo_irm
001309.SZ,szse,2277394546476802048,2026-05-27,2026-06-04,请问贵公司最新一期的股东人数是多少？谢谢！,感谢您的关注！截至2026年5月29日公司含信用账户合并股东名册的股东数为99252户。,substantive,unclassified,official interaction without a mapped investable theme,manual review required,higher-official-signal,https://irm.cninfo.com.cn/ircs/question/questionDetail?questionId=2277394546476802048,cninfo_irm
