ts_code,exchange,question_id,question_time,answer_time,question,answer,answer_class,theme,story_read,proof_needed,credibility,source_url,source_type
001309.SZ,szse,2276711698017927168,2026-05-26,2026-06-04,董秘你好！请问公司最近一期的股东人数是多少,感谢您的关注！截至2026年5月29日公司含信用账户合并股东名册的股东数为99252户。,substantive,unclassified,official interaction without a mapped investable theme,manual review required,higher-official-signal,https://irm.cninfo.com.cn/ircs/question/questionDetail?questionId=2276711698017927168,cninfo_irm
001309.SZ,szse,2276184259052527616,2026-05-25,2026-06-04,请问公司的业务是否深度受益于华为提出的“韬定律”，若产业格局被“韬定律”重塑，企业级SSD和高端嵌入式存储的需求是否进一步增长？,感谢您的关注！“韬定律”是对产业演进方向的重要行业洞察，公司对此保持积极关注与学习。公司在企业级SSD与嵌入式存储领域已有完善的产品布局，并已实现规模销售，公司将持续关注产业格局变化，积极把握行业需求增长带来的业务发展机遇。,directional-but-unquantified,unclassified,official interaction without a mapped investable theme,manual review required,medium-official-signal,https://irm.cninfo.com.cn/ircs/question/questionDetail?questionId=2276184259052527616,cninfo_irm
001309.SZ,szse,2272809686068191232,2026-05-21,2026-06-04,您好，请问截止到5月20日，贵司的股东数量是多少？,感谢您的关注！截至2026年5月20日公司含信用账户合并股东名册的股东数为100713户。,substantive,unclassified,official interaction without a mapped investable theme,manual review required,higher-official-signal,https://irm.cninfo.com.cn/ircs/question/questionDetail?questionId=2272809686068191232,cninfo_irm
001309.SZ,szse,2272408115017531393,2026-05-20,2026-06-04,请问最新股东总户数，谢谢！,感谢您的关注！截至2026年5月29日公司含信用账户合并股东名册的股东数为99252户。,substantive,unclassified,official interaction without a mapped investable theme,manual review required,higher-official-signal,https://irm.cninfo.com.cn/ircs/question/questionDetail?questionId=2272408115017531393,cninfo_irm
001309.SZ,szse,2268336503200792576,2026-05-15,2026-06-04,董秘您好，请问贵公司通过英伟达Hopper架构的产品占比大概有多少？,感谢您的关注！公司尚未与您提到的特定客户有直接业务合作，公司正持续提升企业级存储产品对主流服务器平台的兼容性适配，目前已完成飞腾生态体系合作伙伴认证、OpenCloudOS 及腾讯云技术兼容互认证，加入海光产业生态合作组织及中国移动 “千帆” 生态联盟。公司企业级存储产品已进入多家国内头部互联网及服务器厂商供应链并实现规模销售，相关收入规模及占比持续提升，具体业务进展情况，请以公司在法定信息披露媒体发布的公告为准。,non-committal,unclassified,official interaction without a mapped investable theme,manual review required,weak-official-signal,https://irm.cninfo.com.cn/ircs/question/questionDetail?questionId=2268336503200792576,cninfo_irm
001309.SZ,szse,2270627301317525504,2026-05-18,2026-05-26,尊敬的董事会秘书你好，请问公司如何看待AI发展对存储的需求，公司业绩还能继续维持当前的发展势头吗？,感谢您的关注！公司密切关注AI技术发展对存储行业带来的深远影响。AI大模型训练与推理正驱动存储需求快速增长，存储从算力配套升级为AI核心基础设施，为行业打开长期增长空间。公司积极把握这一趋势，以全栈存储解决方案为核心，持续加大企业级SSD、自研主控芯片等领域的研发投入，并于近期正式启用光明智能制造基地，强化高端制造与规模化交付能力。目前公司在手订单充足，在当前行业高景气、供需偏紧背景下，预期公司能够保持良好的业绩水平。,substantive,compute-power,new-demand adjacency around power + computing infrastructure,"needs revenue, order, or project economics before valuation uplift",higher-official-signal,https://irm.cninfo.com.cn/ircs/question/questionDetail?questionId=2270627301317525504,cninfo_irm
001309.SZ,szse,2269228722546868224,2026-05-16,2026-05-26,近期存储行业景气度回升，产品价格持续上涨。面对这一轮上行周期，公司是否有信心在今年实现毛利率和净利率的双重提升,感谢您的关注！当前存储行业正经历由AI需求驱动的结构性景气周期，主流机构对行业景气度的延续持乐观预期。目前公司在手订单充足，在当前行业高景气、供需偏紧背景下，预期公司能够保持良好的业绩水平。,substantive,unclassified,official interaction without a mapped investable theme,manual review required,higher-official-signal,https://irm.cninfo.com.cn/ircs/question/questionDetail?questionId=2269228722546868224,cninfo_irm
001309.SZ,szse,2269089849074319360,2026-05-16,2026-05-26,存储处于极高位，即使接下去能一直维持高位，但只要晶圆涨势趋缓，接下去的利润大头只会是晶圆厂而不是模组厂的，模组厂去年底今年一季度靠存储短时间暴涨攫取了巨额利润，但接下去即使长时间晶圆维持高位，模组厂所进的晶圆到货生产成模组后，如果晶圆还跟进货价维持平衡或者只是小涨，模组厂将会面临比较微薄利润，贵司怎么解决这个迫在眉睫的难题？,感谢您的关注！本轮存储行业景气周期与过往存在差异，是在AI驱动需求爆发、行业供给资源向高附加值领域集中等多重因素共振下的行业发展新阶段。公司已与行业头部上游供应商维持多年稳定合作关系，能够有效保障核心原材料的稳定供应，同时遵循市场化定价原则，确保各项业务平稳有序开展。此外，公司将通过持续拓展产品矩阵、加大研发创新提升产品竞争力、优化质量与成本控制体系等方式，积极应对行业周期变化。,directional-but-unquantified,unclassified,official interaction without a mapped investable theme,manual review required,medium-official-signal,https://irm.cninfo.com.cn/ircs/question/questionDetail?questionId=2269089849074319360,cninfo_irm
001309.SZ,szse,2270379498904289280,2026-05-17,2026-05-22,贵司的存储芯片能否用在国产六代机上？,感谢您的关注！公司专注于闪存主控芯片设计及存储模组解决方案，产品已广泛应用于数据中心、消费电子、车载电子等多元化场景，目前并未涉及您所提及的场景应用。公司致力于技术创新与应用场景拓展，后续具体业务发展情况敬请关注公司后续信息披露。,substantive,compute-power,new-demand adjacency around power + computing infrastructure,"needs revenue, order, or project economics before valuation uplift",higher-official-signal,https://irm.cninfo.com.cn/ircs/question/questionDetail?questionId=2270379498904289280,cninfo_irm
001309.SZ,szse,2269228396109479936,2026-05-16,2026-05-22,注意到公司正在大力布局企业级SSD业务，这也是国产替代的重点。目前这块业务的客户拓展进展如何？是否已经形成规模化的营收贡献？,感谢您的关注！公司高度重视企业级SSD业务的战略布局与发展。在客户拓展方面，公司企业级存储产品已成功进入多家互联网厂商及服务器品牌供应链，并实现规模销售。公司企业级业务目前正处于加速扩张阶段，相关客户和项目稳步推进，企业级收入规模及收入占比均在持续提升。,substantive,unclassified,official interaction without a mapped investable theme,manual review required,higher-official-signal,https://irm.cninfo.com.cn/ircs/question/questionDetail?questionId=2269228396109479936,cninfo_irm
001309.SZ,szse,2268785198434205696,2026-05-15,2026-05-22,公司预计下半年订单量如何,感谢您的关注！目前公司在手订单充足，上游供应稳定，可充分满足当前经营发展及订单交付需求。在当前存储行业高景气、供需偏紧的背景下，公司将持续深化与各领域客户的合作，积极把握市场机遇，具体经营情况请以公司后续在指定信息披露媒体发布的正式公告为准。,non-committal,unclassified,official interaction without a mapped investable theme,manual review required,weak-official-signal,https://irm.cninfo.com.cn/ircs/question/questionDetail?questionId=2268785198434205696,cninfo_irm
001309.SZ,szse,2268670334027259904,2026-05-15,2026-05-22,您好，请问下截止第一季度股东数量变动情况？,感谢您的关注！截至2026年3月31日公司含信用账户合并股东名册的股东数为55931户。,substantive,unclassified,official interaction without a mapped investable theme,manual review required,higher-official-signal,https://irm.cninfo.com.cn/ircs/question/questionDetail?questionId=2268670334027259904,cninfo_irm
001309.SZ,szse,2268666777794338816,2026-05-15,2026-05-22,尊敬的董秘你好，今年以来，公司业绩爆发，背后的原因是什么，公司在研发方面有哪些计划，如何维持高景气度发展,感谢您的关注！公司一季度经营业绩的快速增长除行业景气度外，也极大得益于公司前期在企业级、嵌入式以及国产化等方向上的前瞻性布局。研发方面，公司2025年研发投入达2.92亿元，研发人员增至437人，2026年已推出企业级自研主控芯片H3361，光明智能制造基地定位高端制造与测试验证中心，主要涉及企业级与嵌入式存储产品，公司将持续围绕主控芯片、固件算法、介质研究及智能制造等核心方向加大投入。公司在手订单充足，在当前行业供需格局偏紧背景下，预期能够保持良好业绩水平。未来，公司将持续聚焦主营业务，不断提升核心竞争力和经营管理水平，努力实现公司持续健康发展，切实维护广大投资者利益。,substantive,unclassified,official interaction without a mapped investable theme,manual review required,higher-official-signal,https://irm.cninfo.com.cn/ircs/question/questionDetail?questionId=2268666777794338816,cninfo_irm
001309.SZ,szse,2268658728827207680,2026-05-15,2026-05-22,尊敬的董秘你好，公司一季度业绩非常好，请问这种良好的势头能维持多长时间,感谢您的关注！公司一季度经营业绩的快速增长除行业景气度外，也极大得益于公司前期在企业级、嵌入式以及国产化等方向上的前瞻性布局。公司在手订单充足，在当前行业供需格局偏紧背景下，预期能够保持良好业绩水平。未来，公司将持续聚焦主营业务，不断提升核心竞争力和经营管理水平，努力实现公司持续健康发展，切实维护广大投资者利益。,substantive,unclassified,official interaction without a mapped investable theme,manual review required,higher-official-signal,https://irm.cninfo.com.cn/ircs/question/questionDetail?questionId=2268658728827207680,cninfo_irm
001309.SZ,szse,2268120664112717824,2026-05-14,2026-05-22,请贵司董秘部门及相关负责人尽快回复股民的问题:1、《深圳证券交易所上市公司自律监管指引第11号——信息披露工作考核》第十五条要求将互动易回复情况纳入上市公司信息披露评价考核范围；2、《关于深圳证券交易所“互动易”有关事项的通知》中规定：“如无特殊原因，上市公司原则上应当在两个交易日内答复互动易上的投资者提问；如涉及暂时无法解答的问题，也应当及时做出回复，并说明暂时无法解答的原因。”,感谢您的关注！公司将持续规范做好互动易平台投资者提问的答复工作，切实保障广大投资者的知情权。,directional-but-unquantified,unclassified,official interaction without a mapped investable theme,manual review required,medium-official-signal,https://irm.cninfo.com.cn/ircs/question/questionDetail?questionId=2268120664112717824,cninfo_irm
001309.SZ,szse,2266849396742774784,2026-05-13,2026-05-22,董秘你好，请介绍一下光明智能制造基地的基本情况，该基地企业级与嵌入式存储产品设计能力有多少？目前产能利用率如何？谢谢！,感谢您的关注！公司光明智能制造基地定位为公司高端制造与测试验证中心，主要涉及企业级与嵌入式存储产品，投产后将形成覆盖智能制造、测试验证及规模化交付的一体化高端制造体系，具备企业级SSD、RDIMM及嵌入式存储等产品的测试与规模量产能力。目前光明基地正处于产能爬坡阶段，整体产能利用率处于合理水平，相关经营情况请以公司后续披露的定期报告为准。,non-committal,unclassified,official interaction without a mapped investable theme,manual review required,weak-official-signal,https://irm.cninfo.com.cn/ircs/question/questionDetail?questionId=2266849396742774784,cninfo_irm
001309.SZ,szse,2266259019128201216,2026-05-12,2026-05-22,看到贵司的一季度报存货显著增长，请问现在的原材料采购价跟去年相比是否有涨价？,感谢您的关注！原材料价格受供需格局、原厂产能等多重因素影响，您可通过查阅相关媒体报道、行业垂直机构报告等方式了解跟踪。关于公司原材料采购价格的具体变动情况，请以公司后续披露的定期报告为准。,non-committal,unclassified,official interaction without a mapped investable theme,manual review required,weak-official-signal,https://irm.cninfo.com.cn/ircs/question/questionDetail?questionId=2266259019128201216,cninfo_irm
001309.SZ,szse,2265827838573002752,2026-05-11,2026-05-22,您好董秘，之前在投资者交流会中，贵公司提及市场机构Trendforce集邦咨询预估2026年二季度一般型Dram合约价季增58-63%，HAND Flash合约价季增70-75%，请问这两个合约价是指公司购入原厂的晶圆成本合约价还是下游模组产品的出货合约价？,感谢您的关注！行业中一般将上游原厂供货的晶圆或颗粒层面交易价格称为合约价。在投资者交流会上提及的相关合约价数据为TrendForce集邦咨询发布的行业公开市场预测数据，公司不对第三方机构发布的行业数据的具体口径进行解读。公司的采购及销售价格情况请以公司在指定信息披露媒体发布的定期报告等相关公告为准。,non-committal,unclassified,official interaction without a mapped investable theme,manual review required,weak-official-signal,https://irm.cninfo.com.cn/ircs/question/questionDetail?questionId=2265827838573002752,cninfo_irm
001309.SZ,szse,2265564522803834880,2026-05-11,2026-05-22,董秘好，请您介绍一下本公司与闪迪的合作关系及发展前景！谢谢！,感谢您的关注！公司存储产品方案广泛支持多家存储原厂的相关存储晶圆产品，与上游多家存储原厂保持着长期稳定的合作关系，公司将持续深化与上下游合作伙伴的协同，共同推动存储行业的发展。,directional-but-unquantified,unclassified,official interaction without a mapped investable theme,manual review required,medium-official-signal,https://irm.cninfo.com.cn/ircs/question/questionDetail?questionId=2265564522803834880,cninfo_irm
001309.SZ,szse,2263234777923661824,2026-05-08,2026-05-22,李虎董事长是不是有大股东内部代持股份？,感谢您的关注！公司严格按照相关法律法规及监管要求履行信息披露义务，不存在相关情形。,directional-but-unquantified,unclassified,official interaction without a mapped investable theme,manual review required,medium-official-signal,https://irm.cninfo.com.cn/ircs/question/questionDetail?questionId=2263234777923661824,cninfo_irm
001309.SZ,szse,2260977076824911872,2026-05-05,2026-05-19,公司产品中长期还有涨价预期吗？,感谢您的关注！当前存储芯片行业正经历由AI需求驱动的结构性景气周期，市场机构TrendForce集邦咨询预估2026年第二季度一般型DRAM合约价格季增58-63%，NAND Flash合约价格季增70-75%。公司遵循市场化定价原则，产品定价综合考量市场供需环境、行业发展趋势、原材料成本及客户需求等多种因素协商确定。同时，存储行业价格受多重复杂因素影响，敬请广大投资者理性投资，注意投资风险。,substantive,unclassified,official interaction without a mapped investable theme,manual review required,higher-official-signal,https://irm.cninfo.com.cn/ircs/question/questionDetail?questionId=2260977076824911872,cninfo_irm
001309.SZ,szse,2260976355270406144,2026-05-05,2026-05-19,存储芯片中长期还有涨价预期吗？,感谢您的关注！当前存储芯片行业正经历由AI需求驱动的结构性景气周期，市场机构TrendForce集邦咨询预估2026年第二季度一般型DRAM合约价格季增58-63%，NAND Flash合约价格季增70-75%。公司遵循市场化定价原则，产品定价综合考量市场供需环境、行业发展趋势、原材料成本及客户需求等多种因素协商确定。同时，存储行业价格受多重复杂因素影响，敬请广大投资者理性投资，注意投资风险。,substantive,unclassified,official interaction without a mapped investable theme,manual review required,higher-official-signal,https://irm.cninfo.com.cn/ircs/question/questionDetail?questionId=2260976355270406144,cninfo_irm
001309.SZ,szse,2253138718587330560,2026-04-24,2026-05-19,请问贵公司的存储产品能够适配华为昇腾950超节点吗？是贵公司是否已和华为开展合作？是否已有样品在测试？,感谢您的关注！公司积极布局企业级存储产品，已研发并推出适用于数据中心、服务器、智算中心等高负载场景的大容量、高性能企业级存储解决方案，并持续推进与各主流硬件平台的适配验证工作。因客户合作方面信息属于商业机密，不便对外透露。公司始终严格遵守信息披露相关规定，如有需披露的重大合作进展，公司将及时通过法定渠道履行信息披露义务。,substantive,compute-power,new-demand adjacency around power + computing infrastructure,"needs revenue, order, or project economics before valuation uplift",higher-official-signal,https://irm.cninfo.com.cn/ircs/question/questionDetail?questionId=2253138718587330560,cninfo_irm
001309.SZ,szse,2263200864861892608,2026-05-08,2026-05-18,请问董秘，公司定向增发进度如何？,感谢您的关注！目前公司定增项目在顺利推进过程中，后续将按照相关监管要求继续推进审核程序。,directional-but-unquantified,unclassified,official interaction without a mapped investable theme,manual review required,medium-official-signal,https://irm.cninfo.com.cn/ircs/question/questionDetail?questionId=2263200864861892608,cninfo_irm
001309.SZ,szse,2261875463724150784,2026-05-06,2026-05-18,您好，请问贵公司的低价库存芯片在一季度销售多少？剩余低价库存预计什么时间销售完毕？谢谢,感谢您的关注！公司发出存货采用月末一次加权平均法核算，能够平滑各期成本波动。公司已建立完善的库存管理机制，具备应对行业周期变化、做好供应链管控与库存管理的核心运营能力，具体经营数据敬请关注公司后续定期报告。,directional-but-unquantified,unclassified,official interaction without a mapped investable theme,manual review required,medium-official-signal,https://irm.cninfo.com.cn/ircs/question/questionDetail?questionId=2261875463724150784,cninfo_irm
001309.SZ,szse,2261771104608792576,2026-05-06,2026-05-18,存储行业因为AI的发展，全球共振，需求旺盛，供不应求，请问公司是否考虑和终端客户签署比如3年5年的长约，谢谢。,感谢您的关注！公司始终高度重视与终端客户的长期稳定合作，将根据行业发展趋势、市场供需情况及客户实际需求，持续优化客户合作机制，不断提升供应链保障能力与客户服务水平，推动公司业务持续健康发展。因客户合作方面信息属于商业机密，不便对外透露，公司将严格按照相关规定及时履行信息披露义务。,substantive,unclassified,official interaction without a mapped investable theme,manual review required,higher-official-signal,https://irm.cninfo.com.cn/ircs/question/questionDetail?questionId=2261771104608792576,cninfo_irm
001309.SZ,szse,2261720638770356224,2026-05-06,2026-05-18,请问一下贵公司4月30日股东人数是多少？谢谢！,感谢您的关注！截至2026年4月30日公司含信用账户合并股东名册的股东数为86320户。,substantive,unclassified,official interaction without a mapped investable theme,manual review required,higher-official-signal,https://irm.cninfo.com.cn/ircs/question/questionDetail?questionId=2261720638770356224,cninfo_irm
001309.SZ,szse,2257309277946138624,2026-04-30,2026-05-18,请问：4月30日的股东人数？谢谢,感谢您的关注！截至2026年4月30日公司含信用账户合并股东名册的股东数为86320户。,substantive,unclassified,official interaction without a mapped investable theme,manual review required,higher-official-signal,https://irm.cninfo.com.cn/ircs/question/questionDetail?questionId=2257309277946138624,cninfo_irm
001309.SZ,szse,2256578042498621440,2026-04-29,2026-05-18,您好，未来车载存储芯片放量，公司在相关领域有布局吗？主要客户是否包含海外客户？,感谢您的关注！公司作为专业存储控制芯片及解决方案提供商，依托技术积累与定制化解决方案能力，正积极拓展车载电子等新兴应用市场，部分车规级存储产品可应用于车载设备，且已与部分知名汽车厂商建立合作，具体业务进展情况请以公司在指定信息披露媒体发布的公告为准。,non-committal,unclassified,official interaction without a mapped investable theme,manual review required,weak-official-signal,https://irm.cninfo.com.cn/ircs/question/questionDetail?questionId=2256578042498621440,cninfo_irm
001309.SZ,szse,2250043095111643136,2026-04-20,2026-05-08,尊敬的董秘，您好！公司的HBM产品什么时候能落地量产？,感谢您的关注！公司始终紧密跟踪AI、云计算等新兴技术对存储产品的多样化需求，结合公司实际情况加快对CXL、新型存储介质等前沿技术的探索与研发，HBM领域暂无实际布局落地。,directional-but-unquantified,unclassified,official interaction without a mapped investable theme,manual review required,medium-official-signal,https://irm.cninfo.com.cn/ircs/question/questionDetail?questionId=2250043095111643136,cninfo_irm
001309.SZ,szse,2247923537255731200,2026-04-17,2026-05-08,强烈要求贵司一季报高送转。股价太高了，我等小散户强烈看好却买不起啊！,感谢您的关注！您的建议公司已收悉，公司利润分配方案将结合实际经营情况、未来发展战略、股东回报规划及相关法律法规要求综合审慎研究制定，相关信息请以公司在指定信息披露媒体发布的正式公告为准，敬请广大投资者理性投资，注意投资风险。,non-committal,unclassified,official interaction without a mapped investable theme,manual review required,weak-official-signal,https://irm.cninfo.com.cn/ircs/question/questionDetail?questionId=2247923537255731200,cninfo_irm
001309.SZ,szse,2255020644380127232,2026-04-27,2026-04-29,贵司的一季度季报什么时候更新,感谢您的关注！公司 2026 年第一季度报告已预约于 2026 年 4 月 30 日披露，具体请以公司公告为准。,non-committal,unclassified,official interaction without a mapped investable theme,manual review required,weak-official-signal,https://irm.cninfo.com.cn/ircs/question/questionDetail?questionId=2255020644380127232,cninfo_irm
001309.SZ,szse,2252907151103307776,2026-04-24,2026-04-29,尊敬的的董秘您好！美方的MATCH法案对长江存储、长鑫存储的国产化存储晶圆发展实行打压，对公司今后获取国产晶圆有何不利的影响？公司原材料采购的第一大客户占比百分之34，是否是长江存储？目前公司采购原厂晶圆的客户有哪些？采购的进展是否正常进行？谢谢！,感谢您的关注！公司密切关注国际贸易政策及相关行业动态，已建立多元化的存储晶圆采购渠道和完善的供应链管理体系，与多家存储原厂或其主要经销商建立了长期战略合作关系，积极采取多方面措施保障供应链的稳定与安全，目前公司原材料采购及生产经营活动均正常开展；关于公司供应商的具体信息涉及商业秘密不便透露，请您以公司在指定信息披露媒体发布的定期报告等相关公告为准。,non-committal,unclassified,official interaction without a mapped investable theme,manual review required,weak-official-signal,https://irm.cninfo.com.cn/ircs/question/questionDetail?questionId=2252907151103307776,cninfo_irm
