ts_code,exchange,question_id,question_time,answer_time,question,answer,answer_class,theme,story_read,proof_needed,credibility,source_url,source_type
002714.SZ,szse,2210487597786054656,2026-02-26,2026-03-02,温氏股份近期进行回购激励，建议公司也回购，因为港股上市融资了，国内限产资本开资少，除开每年还100亿债，未来5年每年折旧都140亿，建议公司每年回购30-40亿注销。,您好，公司自上市以来一直重视投资者回报，将持续做好经营管理，提升盈利能力，更好地为股东创造回报。未来如有相关计划，将严格按照法律法规的要求及时履行信息披露义务。感谢您的关注及建议！,substantive,buyback-shareholder-return,shareholder-return / valuation-support narrative,"needs board approval, execution, and funding visibility",higher-official-signal,https://irm.cninfo.com.cn/ircs/question/questionDetail?questionId=2210487597786054656,cninfo_irm
002714.SZ,szse,2209665472326123520,2026-02-24,2026-03-02,董秘你好，从2025年全年来看，公司成本控制成效显著，生猪养殖（884275）完全成本整体呈现下降趋势，全年平均成本在12元/kg左右，2026年公司出栏量目标是多少？完全成本是多少？,您好，公司会结合自身生产经营规划及市场情况等因素综合制定2026年出栏目标及成本目标，请关注后续相关信息。公司会聚焦主业，坚持稳健发展，持续降本增效，提升发展质量。感谢您的关注！,substantive,unclassified,official interaction without a mapped investable theme,manual review required,higher-official-signal,https://irm.cninfo.com.cn/ircs/question/questionDetail?questionId=2209665472326123520,cninfo_irm
002714.SZ,szse,2209193644220153856,2026-02-24,2026-03-02,请正面回答问题，不要答非所问。公司已制定及實施「天網工程」，具有新风空气过滤系统、独立通风系统、智能环控系统、智能饲喂系统、智能生豬健康管理系統等自主研发的智能化装备。建立了机械化、自动化、智能化养殖系统。请问：1.为什么生产指标还会大幅波动？2.为什么一到冬季生猪养殖成本就大幅上升？3.什么时候可以做到避免因季节变化导致的养殖成本大幅波动？4.现阶段人为因素对养殖成本的影响到底有多大？,您好，每年冬季是各类疫病的高发期，近期公司的生猪养殖完全成本环比上升的原因主要为冬季加大了疫病防控的投入以及费用增加，并且近期生产指标有一定波动。后续公司会通过优化硬件装备、加强人员管理来提升生猪健康水平，持续改善各项生产指标。在硬件装备上，公司会逐步提升各类智能化装备的覆盖率及运行的稳定性，根据业务需求不断优化系统设计，促进其与生产管理的融合，以更好地支撑养猪生产；在人员管理上，公司会建立各项业务流程的标准化操作方案，加强对一线员工的培训赋能，帮助其提升业务能力，保障各项管理方案的落地效果。感谢您的关注！,substantive,unclassified,official interaction without a mapped investable theme,manual review required,higher-official-signal,https://irm.cninfo.com.cn/ircs/question/questionDetail?questionId=2209193644220153856,cninfo_irm
002714.SZ,szse,2209131496222081024,2026-02-24,2026-03-02,请问公司响应国家调控产能，降低能繁母猪的底线是多少？自从公司主动调降能繁母猪开始，管理有关注公司的股价吗，喋喋不休。响应国家政策是政治正确，无可厚非，但是希望有个度。希望公司做决策的时候也考虑下这么多年支持公司、相信公司的广大小股东，作为一个持有公司6年的小股东的诉求。,您好，二级市场股价受多种因素影响。公司会加强与资本市场投资者的沟通，积极传递公司在新发展阶段的投资价值，结合实际情况综合运用多种方式稳定投资者信心，推动公司投资价值合理反映公司经营质量。同时，公司会聚焦主业，持续做好经营管理，提升生产效率与盈利能力，保证公司高质量稳定发展，更好地为股东创造回报。感谢您的关注！,substantive,unclassified,official interaction without a mapped investable theme,manual review required,higher-official-signal,https://irm.cninfo.com.cn/ircs/question/questionDetail?questionId=2209131496222081024,cninfo_irm
002714.SZ,szse,2205268070021402624,2026-02-19,2026-03-02,尊敬的董事，去年农业农村部号召反内卷，公司积极响应，削减能繁母猪，叫停扩建项目。那请问，公司今年的出栏目标是多少呢，是否符合去年农业农村部建议各地上市猪企26年出栏量比之25念下降10%的要求？,您好，公司会结合自身生产经营规划及市场情况等因素综合制定2026年出栏目标，请关注后续相关信息。感谢您的关注！,substantive,unclassified,official interaction without a mapped investable theme,manual review required,higher-official-signal,https://irm.cninfo.com.cn/ircs/question/questionDetail?questionId=2205268070021402624,cninfo_irm
002714.SZ,szse,2201201397455765504,2026-02-13,2026-03-02,阅读2025年9月30日公司披露的财务报表数据根据资产负债表的情况来看，公司的有息负债占比比较多，存在着短期偿债压力。请问公司后续有什么措施来有效解决财务上的压力和有效降低企业的负债率，使公司的发展更健康。,您好，2025年以来，公司财务状况持续优化，经营现金流充裕。截至2025年三季度末，公司资产负债率为55.50%，较年初下降3.18个百分点，负债总额较年初已下降约98亿元，如果考虑10月完成的50亿元权益分派，去年提出的降负债目标已超额完成。当前公司已完成大规模产能建设，进入稳健发展期，未来资本开支呈下降趋势，自由现金流水平将稳步提升，为降低负债提供坚实基础。后续公司会坚持稳健运营，深挖成本下降空间，提升盈利能力与现金流创造能力，同时不断优化债务结构，合理利用多种融资工具降低融资成本，将财务指标保持在更为安全、健康的水平，提升公司整体的经营质量。感谢您的关注！,substantive,unclassified,official interaction without a mapped investable theme,manual review required,higher-official-signal,https://irm.cninfo.com.cn/ircs/question/questionDetail?questionId=2201201397455765504,cninfo_irm
002714.SZ,szse,2200323643579416576,2026-02-12,2026-02-24,公司已制定及實施「天網工程」，具有新风空气过滤系统、独立通风系统、智能环控系统、智能饲喂系统、智能生豬健康管理系統等自主研发的智能化装备，能夠通過移動設備和計算機來調節豬舍內的溫度、濕度和光照等環境參數。请问：为什么一到冬季生猪养殖成本就大幅上升？什么时候可以做到避免因季节变化导致的养殖成本大幅波动？,您好，公司生猪养殖完全成本在月度间受饲料原材料价格、生产指标波动、费用投入等因素影响，存在正常的阶段性波动。但从2025年全年来看，公司成本控制成效显著，生猪养殖完全成本整体呈现下降趋势，全年平均成本在12元/kg左右，同比下降约2元/kg。长期来看，公司对后续成本进一步下降充满信心，将持续聚焦生猪健康管理与精细化生产管理，不断提升猪群健康水平，改善各项生产指标，通过降本增效提升盈利能力。感谢您的关注！,substantive,unclassified,official interaction without a mapped investable theme,manual review required,higher-official-signal,https://irm.cninfo.com.cn/ircs/question/questionDetail?questionId=2200323643579416576,cninfo_irm
002714.SZ,szse,2199509042723487744,2026-02-11,2026-02-24,请问2026年的出栏计划和成本目标确定了吗，以及1月的完全成本为什么持续上升？谢谢,您好，公司2026年出栏指引及成本目标请关注后续相关信息。公司2026年1月的生猪养殖完全成本环比上升的原因主要为公司在冬季加大了疫病防控的投入以及费用增加，并且近期生产指标有一定波动。后续公司会做好生猪的健康管理，提升猪群健康水平，持续改善各项生产指标，实现养殖成本的进一步下降。感谢您的关注！,substantive,unclassified,official interaction without a mapped investable theme,manual review required,higher-official-signal,https://irm.cninfo.com.cn/ircs/question/questionDetail?questionId=2199509042723487744,cninfo_irm
002714.SZ,szse,2199438175763103744,2026-02-11,2026-02-24,请问2026年的出栏计划和目标成本确定了吗，以及一月的完全成本为什么不降反升？谢谢！,您好，公司2026年出栏指引及成本目标请关注后续相关信息。公司2026年1月的生猪养殖完全成本环比上升的原因主要为公司在冬季加大了疫病防控的投入以及费用增加，并且近期生产指标有一定波动。后续公司会做好生猪的健康管理，提升猪群健康水平，持续改善各项生产指标，实现养殖成本的进一步下降。感谢您的关注！,substantive,unclassified,official interaction without a mapped investable theme,manual review required,higher-official-signal,https://irm.cninfo.com.cn/ircs/question/questionDetail?questionId=2199438175763103744,cninfo_irm
002714.SZ,szse,2198768135273824256,2026-02-10,2026-02-24,经历连续巨额分红，大股东实现了0质押，成功上岸，请问公司有没有帮助广大中小投资者上岸的措施与计划？谢谢。,您好，公司会聚焦主业，持续做好经营管理，提升生产效率与盈利能力，保证公司高质量稳定发展，更好地为股东创造回报。感谢您的关注！,substantive,unclassified,official interaction without a mapped investable theme,manual review required,higher-official-signal,https://irm.cninfo.com.cn/ircs/question/questionDetail?questionId=2198768135273824256,cninfo_irm
002714.SZ,szse,2198071302599852032,2026-02-09,2026-02-24,公司已制定及實施「天網工程」，具有新风空气过滤系统、独立通风系统、智能环控系统、智能饲喂系统、智能生豬健康管理系統等自主研发的智能化装备，能夠通過移動設備和計算機來調節豬舍內的溫度、濕度和光照等環境參數。可为什么一到冬季生猪养殖成本就大幅上升？什么时候可以做到避免因季节变化导致的养殖成本大幅波动？,您好，公司生猪养殖完全成本在月度间受饲料原材料价格、生产指标波动、费用投入等因素影响，存在正常的阶段性波动。但从2025年全年来看，公司成本控制成效显著，生猪养殖完全成本整体呈现下降趋势，全年平均成本在12元/kg左右，同比下降约2元/kg。长期来看，公司对后续成本进一步下降充满信心，将持续聚焦生猪健康管理与精细化生产管理，不断提升猪群健康水平，改善各项生产指标，通过降本增效提升盈利能力。感谢您的关注！,substantive,unclassified,official interaction without a mapped investable theme,manual review required,higher-official-signal,https://irm.cninfo.com.cn/ircs/question/questionDetail?questionId=2198071302599852032,cninfo_irm
002714.SZ,szse,2268791443585089536,2026-05-15,,去年国家能繁调控，公司积极响应做表率，但很多别的公司没有降，想着吃政策红利，可惜没吃着。现在国家又降能繁，赌行情吃政策红利的一样不会少。所以，现有竞争环境，公司还是要调整战略，投资重头第一放在加速加大增加国外养殖，第二再扩屠宰，卖饲料，卖仔猪，卖设备。,,unanswered,unclassified,official interaction without a mapped investable theme,manual review required,no-company-signal,https://irm.cninfo.com.cn/ircs/question/questionDetail?questionId=2268791443585089536,cninfo_irm
002714.SZ,szse,2267660819234095104,2026-05-14,2026-05-18,请问贵司公布的生猪完全成本是按照对应上市重量计算的实际成本，还是校正110kg或校正120kg的成本？,您好，公司月度生猪养殖完全成本是按照当月出栏批次进行核算的，是实际销售体重对应的公斤成本。感谢您的关注！,substantive,unclassified,official interaction without a mapped investable theme,manual review required,higher-official-signal,https://irm.cninfo.com.cn/ircs/question/questionDetail?questionId=2267660819234095104,cninfo_irm
002714.SZ,szse,2267578244192862208,2026-05-14,2026-05-18,董秘你好，我是贵公司的一名价值投资者，今年猪价行情一路走低，远低于成本线，整个行业陷入严重亏损，在此行情下如何保证中小投资者权益？贵公司有没有做生猪期货业务？如果有规模是多少？谢谢,您好，生猪价格主要由市场供需影响。公司专注于自身经营管理，通过生猪育种、营养配方、健康管理、智能化等技术的不断创新与落地，持续提升生产效率，通过持续降低成本夯实穿越周期的能力。公司目前期货业务整体规模较小，具体业务开展情况请关注公司定期报告。对于期货业务，公司本着审慎的原则，在控制风险的前提下，结合公司的主营业务特点制定适合公司实际情况的策略，充分利用好期货价格发现、对冲风险的功能。感谢您的关注！,substantive,capital-allocation,capital-allocation quality narrative,needs realized return history or portfolio evidence,higher-official-signal,https://irm.cninfo.com.cn/ircs/question/questionDetail?questionId=2267578244192862208,cninfo_irm
002714.SZ,szse,2266889056560676864,2026-05-13,2026-05-18,请问董秘？最近有新闻说细胞繁殖猪肉技术又获得了新突破，相对于养殖猪肉有，很多优点，如无疾病传染风险，可以定制各个部位等。在未来十到15年会随着技术的进一步提高会大幅降低成本，到时候会取代养殖猪肉。请问公司有没有关注这方面的技术？将如何应对？,您好，公司会对相关领域的技术进展保持关注。感谢您的关注！,non-committal,unclassified,official interaction without a mapped investable theme,manual review required,weak-official-signal,https://irm.cninfo.com.cn/ircs/question/questionDetail?questionId=2266889056560676864,cninfo_irm
002714.SZ,szse,2266242990380269568,2026-05-12,2026-05-18,建议公司尽快邀请一切能够邀请的公募私募负责人到公司调研，多多释放利好，尽最大努力最好市值管理。谢谢。,您好，公司董事会及管理层高度重视市值管理工作，根据相关法律法规制定了《市值管理制度》，未来会根据发展阶段及实际情况，综合运用多种方式做好投资者回报，与投资者共享公司发展成果。并且，公司会加强与资本市场投资者的沟通，积极传递公司在新发展阶段的投资价值，结合实际情况综合运用多种方式稳定投资者信心，推动公司投资价值合理反映公司经营质量。同时，公司会聚焦主业，持续做好经营管理，提升生产效率与盈利能力，保证公司高质量稳定发展，更好地为股东创造回报。感谢您的关注！,substantive,buyback-shareholder-return,shareholder-return / valuation-support narrative,"needs board approval, execution, and funding visibility",higher-official-signal,https://irm.cninfo.com.cn/ircs/question/questionDetail?questionId=2266242990380269568,cninfo_irm
002714.SZ,szse,2263204490110017536,2026-05-08,2026-05-18,公司作为养猪大户，强烈建议公司切实加大研发，争取研发出肉质更细嫩的品种。因为当下猪肉消费量持续下降，除了与生活品质、人口结构等因素有关外，更重要的原因是过于重视降成本导致猪肉品质大幅度下降，如同啃树皮，所以消费量越来越低。一旦研发出高品味猪肉，相信一定能逆转消费量持续下降的现状。谢谢。,您好，随着中国经济发展和消费能力的提升，消费者对猪肉消费的需求由之前量的增长逐步转变为质的提升，对猪肉产品的需求也日益细分和个性化。公司始终以终端消费者的需求为导向开展种猪育种工作，坚持价值育种，持续选育具有优良性状的种猪，并且不断加强对猪肉品质全流程的管理，致力于为消费者提供更高品质的猪肉产品。感谢您的关注及建议！,substantive,unclassified,official interaction without a mapped investable theme,manual review required,higher-official-signal,https://irm.cninfo.com.cn/ircs/question/questionDetail?questionId=2263204490110017536,cninfo_irm
002714.SZ,szse,2267928421446565888,2026-05-14,,有媒体报道，乐安牧原由于将养殖场污水排入河道，被乐安县生态环境局立案调查，请问情况是否属实？,,unanswered,unclassified,official interaction without a mapped investable theme,manual review required,no-company-signal,https://irm.cninfo.com.cn/ircs/question/questionDetail?questionId=2267928421446565888,cninfo_irm
002714.SZ,szse,2261846567479910400,2026-05-06,2026-05-11,请问截止日2026.4.30日的最新持股股东人数是多少,您好，您可发送个人持股证明、身份证复印件到公司证券部邮箱myzqb@muyuanfoods.com查询股东人数，证券部工作人员会及时回复。感谢您的关注！,substantive,unclassified,official interaction without a mapped investable theme,manual review required,higher-official-signal,https://irm.cninfo.com.cn/ircs/question/questionDetail?questionId=2261846567479910400,cninfo_irm
002714.SZ,szse,2261813814032019456,2026-05-06,2026-05-11,请问贵公司，四月份养殖成本是多少？谢谢,您好，公司2026年4月的生猪养殖完全成本在11.7元/kg左右。感谢您的关注！,substantive,unclassified,official interaction without a mapped investable theme,manual review required,higher-official-signal,https://irm.cninfo.com.cn/ircs/question/questionDetail?questionId=2261813814032019456,cninfo_irm
002714.SZ,szse,2257299434064027648,2026-04-30,2026-05-11,早在多年前我就预测随着饮食习惯、生活水平、人口结构、人口数量的改变以及养殖水平普遍提升，能繁母猪3600万头完全能够满足需求，请问我的预测是否科学？如果能繁在3600万头达到平衡，贵公司是否会出现大量闲置产能？如果养殖端都不肯去产能，去产能过程还要延长多久？谢谢。,您好，公司会根据政策导向、外部市场环境及自身生产经营情况，合理规划能繁母猪数量。同时，公司由高速发展阶段转向高质量发展阶段，将持续做好生产管理与经营管理，通过提质增效提升盈利能力。感谢您的关注！,substantive,unclassified,official interaction without a mapped investable theme,manual review required,higher-official-signal,https://irm.cninfo.com.cn/ircs/question/questionDetail?questionId=2257299434064027648,cninfo_irm
002714.SZ,szse,2257289925006434304,2026-04-30,2026-05-11,万科30号公告称要公开出售环山集团的股份，把养猪产业剥离出去，请问公司有没有计划去收购？,您好，公司没有相关计划。感谢您的关注！,non-committal,unclassified,official interaction without a mapped investable theme,manual review required,weak-official-signal,https://irm.cninfo.com.cn/ircs/question/questionDetail?questionId=2257289925006434304,cninfo_irm
002714.SZ,szse,2257247198644482048,2026-04-30,2026-05-11,俗话说，百足之虫死而不僵！公司作为全国规模最大的养猪场，即使猪价长期低迷，只要公司做好市值管理，相信也能激发投资者信心，希望公司通过多组织投资者调研、回购、职工持股、高管和大股东增持等活动，以保护中小股东利益。谢谢。,您好，公司董事会及管理层高度重视市值管理工作，根据相关法律法规制定了《市值管理制度》，未来会根据发展阶段及实际情况，综合运用多种方式做好投资者回报，与投资者共享公司发展成果。并且，公司会加强与资本市场投资者的沟通，积极传递公司在新发展阶段的投资价值，结合实际情况综合运用多种方式稳定投资者信心，推动公司投资价值合理反映公司经营质量。同时，公司会聚焦主业，持续做好经营管理，提升生产效率与盈利能力，保证公司高质量稳定发展，更好地为股东创造回报。感谢您的关注！,substantive,buyback-shareholder-return,shareholder-return / valuation-support narrative,"needs board approval, execution, and funding visibility",higher-official-signal,https://irm.cninfo.com.cn/ircs/question/questionDetail?questionId=2257247198644482048,cninfo_irm
002714.SZ,szse,2262453197336236032,2026-05-07,,您好，贵司披露的2026年3月的生猪养殖完全成本在11.6元/kg左右，请问饲料成本、职工薪酬、折旧摊销、动保费用、四项期间费用的单公斤大致分摊区间分别是多少？该成本是否考虑存货跌价准备的影响？,,unanswered,unclassified,official interaction without a mapped investable theme,manual review required,no-company-signal,https://irm.cninfo.com.cn/ircs/question/questionDetail?questionId=2262453197336236032,cninfo_irm
002714.SZ,szse,2255860087416631296,2026-04-28,2026-05-06,假设生猪价格一直维持当前价格，请问公司现金流（不考虑动用H股再融资资金）还能维持几个月？公司是否对现金断流做了再融资预案？谢谢。,您好，当前公司现金流安全稳定。在当前的市场行情下，公司会通过持续降低成本夯实穿越周期的能力，并且在成本结构中，折旧摊销等非现金成本占比在10%左右。在融资端，公司与银行等金融机构保持稳定、良好的合作关系，授信储备充足。同时，公司积极拓展多元化融资渠道，今年以来发行了多期低成本债券。后续公司会加强现金流的管理，采取稳健的资金管理措施，以确保现金流安全稳定为优先目标，从经营活动、投资活动、融资活动等方面，结合生猪价格、原粮价格等市场因素，规划资金收支，保证公司高质量稳定发展。感谢您的关注！,substantive,unclassified,official interaction without a mapped investable theme,manual review required,higher-official-signal,https://irm.cninfo.com.cn/ircs/question/questionDetail?questionId=2255860087416631296,cninfo_irm
002714.SZ,szse,2255155188794077184,2026-04-27,2026-05-06,请问公司仔猪最近的销售情况如何？销售简报的商品猪口径是否包含仔猪数量？,您好，公司月度销售简报中的商品猪不包含仔猪。感谢您的关注！,non-committal,unclassified,official interaction without a mapped investable theme,manual review required,weak-official-signal,https://irm.cninfo.com.cn/ircs/question/questionDetail?questionId=2255155188794077184,cninfo_irm
002714.SZ,szse,2253665144407302144,2026-04-25,2026-05-06,请问贵公司，截止目前公司现金流还有多少？谢谢！,您好，当前公司现金流安全稳定。在当前的市场行情下，公司会通过持续降低成本夯实穿越周期的能力，并且在成本结构中，折旧摊销等非现金成本占比在10%左右。在融资端，公司与银行等金融机构保持稳定、良好的合作关系，授信储备充足。同时，公司积极拓展多元化融资渠道，今年以来发行了多期低成本债券。后续公司会加强现金流的管理，采取稳健的资金管理措施，以确保现金流安全稳定为优先目标，从经营活动、投资活动、融资活动等方面，结合生猪价格、原粮价格等市场因素，规划资金收支，保证公司高质量稳定发展。感谢您的关注！,substantive,unclassified,official interaction without a mapped investable theme,manual review required,higher-official-signal,https://irm.cninfo.com.cn/ircs/question/questionDetail?questionId=2253665144407302144,cninfo_irm
002714.SZ,szse,2253010179047239681,2026-04-24,2026-05-06,贵公司四月的出栏量是多少？价格多少呢？五月预计出栏量多少呢？,您好，请关注公司后续披露的月度销售简报。感谢您的关注！,non-committal,unclassified,official interaction without a mapped investable theme,manual review required,weak-official-signal,https://irm.cninfo.com.cn/ircs/question/questionDetail?questionId=2253010179047239681,cninfo_irm
002714.SZ,szse,2259842913696718848,2026-05-03,,请问董秘，截止至2026年2月底，贵公司总存栏数大概是多少？谢谢,,unanswered,unclassified,official interaction without a mapped investable theme,manual review required,no-company-signal,https://irm.cninfo.com.cn/ircs/question/questionDetail?questionId=2259842913696718848,cninfo_irm
002714.SZ,szse,2259842810703007744,2026-05-03,,请问董秘，截止至2026年4月底，贵公司总存栏数大概是多少？谢谢,,unanswered,unclassified,official interaction without a mapped investable theme,manual review required,no-company-signal,https://irm.cninfo.com.cn/ircs/question/questionDetail?questionId=2259842810703007744,cninfo_irm
002714.SZ,szse,2259842716128223232,2026-05-03,,请问董秘，截止至2026年3月底，贵公司总存栏数大概是多少？谢谢,,unanswered,unclassified,official interaction without a mapped investable theme,manual review required,no-company-signal,https://irm.cninfo.com.cn/ircs/question/questionDetail?questionId=2259842716128223232,cninfo_irm
