ts_code,exchange,question_id,question_time,answer_time,question,answer,answer_class,theme,story_read,proof_needed,credibility,source_url,source_type
002714.SZ,szse,2236465905043988480,2026-04-02,2026-04-07,作为生猪龙头企业，请问公司如何看待生猪上市企业一哄而上疯狂扩产能？,您好，去年以来，公司已积极响应国家生猪产能调控政策，从减能繁、降体重、限二育等方面进行落实，发挥产能调控带头作用，主动承担社会责任，助力生猪产业稳定健康发展。感谢您的关注！,substantive,unclassified,official interaction without a mapped investable theme,manual review required,higher-official-signal,https://irm.cninfo.com.cn/ircs/question/questionDetail?questionId=2236465905043988480,cninfo_irm
002714.SZ,szse,2235393331272560640,2026-03-31,2026-04-07,温氏响应产能调控，计划供应500头鲜乳猪，贵公司有什么计划响应国家产能调控政策？,您好，去年以来，公司已积极响应国家生猪产能调控政策，从减能繁、降体重、限二育等方面进行落实，发挥产能调控带头作用，主动承担社会责任，助力生猪产业稳定健康发展。感谢您的关注！,substantive,unclassified,official interaction without a mapped investable theme,manual review required,higher-official-signal,https://irm.cninfo.com.cn/ircs/question/questionDetail?questionId=2235393331272560640,cninfo_irm
002714.SZ,szse,2232060754420355072,2026-03-27,2026-04-07,近期，饲料价格明显上涨，生猪价格又持续低迷，部分地区已经跌破9元，请问公司一季度亏损预告何时发布？谢谢。,您好，相关财务数据请关注公司《2026年一季度报告》，已预约披露时间为2026年4月22日。感谢您的关注！,substantive,unclassified,official interaction without a mapped investable theme,manual review required,higher-official-signal,https://irm.cninfo.com.cn/ircs/question/questionDetail?questionId=2232060754420355072,cninfo_irm
002714.SZ,szse,2226816994592321536,2026-03-20,2026-03-27,公司领导：请问公司目前的战略还是降低生猪的养殖成本吗？请问光卖便宜的猪，就是好猪肉吗？胖东来卖低价商品就是好的商超吗？生猪价格低迷，公司有没有考虑向高品质猪肉方向发展。,您好，对标国内外优秀成绩，公司当前生产成绩有进一步的提升空间，将通过加大生猪育种、营养研发、疫病防控、智能化与数字化等生猪养殖全环节上的技术创新投入，深挖每头猪的生长潜能，提升生产效率，降低养殖成本，提升盈利能力。同时，公司会加强对猪肉品质的管理，根据消费者需求开展种猪育种工作及生产管理，品质改善所带来的售价提升后续也将逐步体现，未来公司会通过持续降本和产品价值增益两方面挖掘每一头猪的盈利空间。感谢您的关注！,substantive,unclassified,official interaction without a mapped investable theme,manual review required,higher-official-signal,https://irm.cninfo.com.cn/ircs/question/questionDetail?questionId=2226816994592321536,cninfo_irm
002714.SZ,szse,2226889038373744640,2026-03-20,2026-03-27,牧原股份的养猪业务非常优秀，但是如果不接触养猪的，可能对这个品牌的认知还非常有限。可否开辟一些宣传渠道比如云养猪，电子猪猪直播饲喂互动，宠物仔猪之类的。抓住直播行业，自媒体高速发展的机遇。,您好，感谢您的关注及建议！,non-committal,unclassified,official interaction without a mapped investable theme,manual review required,weak-official-signal,https://irm.cninfo.com.cn/ircs/question/questionDetail?questionId=2226889038373744640,cninfo_irm
002714.SZ,szse,2226839697776787456,2026-03-20,2026-03-27,最近一段时间，生猪已跌至10元附近，据此价格计算，请问公司一季度亏损金额大约是多少？这种亏损状态预计何时能结束？谢谢。,您好，一季度财务数据请关注公司后续披露的定期报告。公司专注于自身经营管理，通过生猪育种、营养配方、健康管理、智能化等技术的不断创新与落地，持续提升生产效率，降低养殖成本，提升盈利能力，更好地为股东创造回报。感谢您的关注！,substantive,unclassified,official interaction without a mapped investable theme,manual review required,higher-official-signal,https://irm.cninfo.com.cn/ircs/question/questionDetail?questionId=2226839697776787456,cninfo_irm
002714.SZ,szse,2226838589821923328,2026-03-20,2026-03-27,中宠股份已经发起可转债全额回购，而贵公司的可转债似乎没有回购计划，请教可转债回购与不回购有强制性要求吗？谢谢。,"您好，根据相关条款约定，在公司可转债转股期内，如果公司股票连续三十个交易日中至少有十五个交易日的收盘价不低于当期转股价格的130%（含130%），或本次发行的可转债未转股余额不足人民币3,000万元时，公司董事会有权决定按照债券面值加当期应计利息的价格赎回全部或部分未转股的可转债。目前可转债赎回条件尚未达成，若未来满足赎回条款约定，公司将充分考虑可转债持有人的利益，审慎决策。感谢您的关注！",substantive,buyback-shareholder-return,shareholder-return / valuation-support narrative,"needs board approval, execution, and funding visibility",higher-official-signal,https://irm.cninfo.com.cn/ircs/question/questionDetail?questionId=2226838589821923328,cninfo_irm
002714.SZ,szse,2229082048571691008,2026-03-23,2026-03-27,股价暴跌，请问公司有不为人知的重大问题吗？H股成功融资后，公司手里握有大量现金，请问会继续大额分红吗？谢谢。,您好，二级市场股价受多种因素影响。目前公司生产经营一切正常，各项业务稳健运营。公司董事会将结合具体经营情况，合理确定利润分配方案，并严格按照相关规定履行决策程序，请关注后续公告。感谢您的关注！,substantive,unclassified,official interaction without a mapped investable theme,manual review required,higher-official-signal,https://irm.cninfo.com.cn/ircs/question/questionDetail?questionId=2229082048571691008,cninfo_irm
002714.SZ,szse,2229076027233382400,2026-03-23,2026-03-27,猪价怎么样,您好，生猪价格主要由市场供需影响。公司专注于自身经营管理，通过生猪育种、营养配方、健康管理、智能化等技术的不断创新与落地，持续提升生产效率，降低养殖成本，提升盈利能力，更好地为股东创造回报。感谢您的关注！,substantive,unclassified,official interaction without a mapped investable theme,manual review required,higher-official-signal,https://irm.cninfo.com.cn/ircs/question/questionDetail?questionId=2229076027233382400,cninfo_irm
002714.SZ,szse,2229848013299068928,2026-03-24,2026-03-27,请问公司近期是否有新的股份回购计划或回购意向？在当前股价出现较大波动的背景下，公司管理层是否会考虑通过回购股份来传递对公司长期价值的信心？如有相关安排，是否方便说明大致规划或后续披露节奏？,您好，二级市场股价受多种因素影响。公司自上市以来一直重视投资者回报，将持续做好经营管理，提升盈利能力，更好地为股东创造回报。未来如有相关计划，将严格按照法律法规的要求及时履行信息披露义务。感谢您的关注！,substantive,buyback-shareholder-return,shareholder-return / valuation-support narrative,"needs board approval, execution, and funding visibility",higher-official-signal,https://irm.cninfo.com.cn/ircs/question/questionDetail?questionId=2229848013299068928,cninfo_irm
002714.SZ,szse,2229788192940601344,2026-03-24,2026-03-27,秦总，您好！公司最近股价遭遇非理性下跌，公司有没有紧急预案来维护？对小股东来说股价如此下跌分红只是杯水车薪，希望公司考虑把部分分红用来回购公司股份并进行注销，给小股东一点希望。,您好，二级市场股价受多种因素影响。公司自上市以来一直重视投资者回报，将持续做好经营管理，提升盈利能力，更好地为股东创造回报。未来如有相关计划，将严格按照法律法规的要求及时履行信息披露义务。感谢您的关注！,substantive,buyback-shareholder-return,shareholder-return / valuation-support narrative,"needs board approval, execution, and funding visibility",higher-official-signal,https://irm.cninfo.com.cn/ircs/question/questionDetail?questionId=2229788192940601344,cninfo_irm
002714.SZ,szse,2223255058088701952,2026-03-15,2026-03-23,公司目前现金流充裕，港股上市后资金实力进一步增强。在当前行业集中度加速提升的背景下，请问公司在内生增长与外延并购之间的资本配置策略是怎样的？如果遇到估值合理的区域优质猪企（如唐人神），公司是否有成熟的并购决策机制和整合经验？,您好，在发展过程中，公司坚持自建产能，现已形成标准化、一体化的运营体系。对于并购整合，公司秉承审慎的态度，若有与公司战略协同、估值合理且风控可控的潜在标的，公司会进行专业研判与评估，并按照相关法律法规的要求及时履行信息披露义务。感谢您的关注！,substantive,unclassified,official interaction without a mapped investable theme,manual review required,higher-official-signal,https://irm.cninfo.com.cn/ircs/question/questionDetail?questionId=2223255058088701952,cninfo_irm
002714.SZ,szse,2223254439613411328,2026-03-15,2026-03-23,董秘您好，近期行业头部企业普遍强调降本增效，行业集中度进一步提升。唐人神作为区域知名猪企，在湖南及周边拥有完善的饲料产能和生猪产能布局。请问公司如何看待当前行业内的并购整合机会？在公司的扩张战略中，是更倾向于自建产能（如现阶段河南、内蒙等地的项目），还是会在估值合理时考虑收购区域优质产能（如唐人神在湖南的基地）以快速提升市占率？,您好，在发展过程中，公司坚持自建产能，现已形成标准化、一体化的运营体系。对于并购整合，公司秉承审慎的态度，若有与公司战略协同、估值合理且风控可控的潜在标的，公司会进行专业研判与评估，并按照相关法律法规的要求及时履行信息披露义务。感谢您的关注！,substantive,unclassified,official interaction without a mapped investable theme,manual review required,higher-official-signal,https://irm.cninfo.com.cn/ircs/question/questionDetail?questionId=2223254439613411328,cninfo_irm
002714.SZ,szse,2223254293450485760,2026-03-15,2026-03-23,公司近期拟将名称变更为＂牧原食品集团股份有限公司＂，明确为顺应国际化战略。在聚焦海外发展的同时，请问公司对国内市场的存量整合持何种态度？面对唐人神这类在湖南及周边拥有完善饲料和生猪产能布局的区域龙头企业，公司是否会考虑通过并购实现＂国内 海外＂双轮驱动？,您好，在发展过程中，公司坚持自建产能，现已形成标准化、一体化的运营体系。对于并购整合，公司秉承审慎的态度，若有与公司战略协同、估值合理且风控可控的潜在标的，公司会进行专业研判与评估，并按照相关法律法规的要求及时履行信息披露义务。感谢您的关注！,substantive,unclassified,official interaction without a mapped investable theme,manual review required,higher-official-signal,https://irm.cninfo.com.cn/ircs/question/questionDetail?questionId=2223254293450485760,cninfo_irm
002714.SZ,szse,2223248203320897536,2026-03-15,2026-03-23,网传贵公司主要靠期货套保套利是否属实，套保规模对贵公司业绩影响多大？,您好，公司目前期货业务整体规模较小，对经营业绩的影响小，具体业务开展情况请关注公司定期报告。对于期货业务，公司本着审慎的原则，在控制风险的前提下，结合公司的主营业务特点制定适合公司实际情况的策略，充分利用好期货价格发现、对冲风险的功能。感谢您的关注！,substantive,unclassified,official interaction without a mapped investable theme,manual review required,higher-official-signal,https://irm.cninfo.com.cn/ircs/question/questionDetail?questionId=2223248203320897536,cninfo_irm
002714.SZ,szse,2224824619380588544,2026-03-17,2026-03-23,最近的公司领导：猪价7年新低，公司最些年提倡的降本增效，只是降低饲养的成本，但老百姓需要是高品质的猪肉，不仅仅是低价就是好猪。希望公司多开发高端的猪肉，不是一味的就是想办法降低生产成本来跟同行内卷。,您好，随着中国经济发展和消费能力的提升，消费者对猪肉消费的需求由之前量的增长逐步转变为质的提升，对猪肉产品的需求也日益细分和个性化。公司始终以终端消费者的需求为导向开展种猪育种工作，坚持价值育种，持续选育具有优良性状的种猪，并且不断加强对猪肉品质全流程的管理，致力于为消费者提供更高品质的猪肉产品。感谢您的关注！,substantive,unclassified,official interaction without a mapped investable theme,manual review required,higher-official-signal,https://irm.cninfo.com.cn/ircs/question/questionDetail?questionId=2224824619380588544,cninfo_irm
002714.SZ,szse,2224249763790483456,2026-03-16,2026-03-23,韩国非瘟是否对国内市场有冲击影响？,您好，相关情况请以官方发布的信息为准。当前公司已对包括非瘟在内的主要疾病实现全面、常态化的防控管理，围绕健康管理研发各类智能装备，不断优化疫病防控标准化业务流程，对于人员、物资、车辆等进行全面管理，同时加强对员工的培训赋能，确保各项生物安全措施在一线得到有效执行，保障生产经营的稳定运行。感谢您的关注！,substantive,unclassified,official interaction without a mapped investable theme,manual review required,higher-official-signal,https://irm.cninfo.com.cn/ircs/question/questionDetail?questionId=2224249763790483456,cninfo_irm
002714.SZ,szse,2223133527694094336,2026-03-15,2026-03-23,请问2026年出栏目标，行业内人士说，监管要求头部企业同比2025年降低10%的出栏量，这个是否属实,您好，公司会结合自身生产经营规划及市场情况等因素综合制定2026年出栏量区间指引，请关注后续相关信息。公司会持续关注相关政策动态，具体内容请以官方发布的信息为准。感谢您的关注！,substantive,unclassified,official interaction without a mapped investable theme,manual review required,higher-official-signal,https://irm.cninfo.com.cn/ircs/question/questionDetail?questionId=2223133527694094336,cninfo_irm
002714.SZ,szse,2220330073544278016,2026-03-11,2026-03-16,请问公司如何看待未来两年行业产能变化及猪价周期演变？在当前行业环境下，公司对能繁母猪存栏、后备母猪补栏节奏和资本开支的规划原则是什么？,您好，在政府生猪产能综合调控与市场自发调节的共同作用下，生猪市场供需格局将逐步改善，有助于推动猪价在中长期维度上回归更加稳定、合理的水平。未来，在政策的精准引导和行业从业者的共同努力下，生猪养殖行业将迈向“稳定健康、高质量发展”的新阶段。公司会根据政策导向、外部市场环境及自身生产经营情况，合理规划能繁母猪数量，并根据生产节奏及需求，动态调整选留后备母猪规模。当前公司已完成大规模产能建设，进入稳健发展期，未来资本开支呈下降趋势，后续公司将结合市场情况、战略发展规划、生产经营需要综合决策每年度资本开支水平。感谢您的关注！,substantive,unclassified,official interaction without a mapped investable theme,manual review required,higher-official-signal,https://irm.cninfo.com.cn/ircs/question/questionDetail?questionId=2220330073544278016,cninfo_irm
002714.SZ,szse,2220262127161655296,2026-03-11,2026-03-16,贵公司在互动平台上回复称“公司2026年1-2月的平均生猪养殖成本在12元/kg左右”请问这个“平均生猪养殖成本”和之前的“完全成本”是一个统计口径？如果不是的话，平均生猪养殖成本相较之前的完全成本增删了哪些项目呢？,您好，是同一个口径。公司生猪养殖完全成本包含养殖、销售过程中发生与承担的所有费用与成本。感谢您的关注！,substantive,unclassified,official interaction without a mapped investable theme,manual review required,higher-official-signal,https://irm.cninfo.com.cn/ircs/question/questionDetail?questionId=2220262127161655296,cninfo_irm
002714.SZ,szse,2218771309800173568,2026-03-09,2026-03-16,贵公司在互动平台上回复称“公司2026年1-2月的平均生猪养殖成本在12元/kg左右。”但之前回答都是“生猪养殖完全成本”，是否意味着公司修改了统计口径,您好，是同一个口径。公司生猪养殖完全成本包含养殖、销售过程中发生与承担的所有费用与成本。感谢您的关注！,substantive,unclassified,official interaction without a mapped investable theme,manual review required,higher-official-signal,https://irm.cninfo.com.cn/ircs/question/questionDetail?questionId=2218771309800173568,cninfo_irm
002714.SZ,szse,2216447440288563200,2026-03-06,2026-03-09,同为AH股份公司，同为过剩产业，同为微利甚至阶段性亏损企业，赛力斯发行H股后市值持续大幅度下滑，而贵公司保持震荡平衡，请问贵司是如何做到的？还在回购股份吗？谢谢。,您好，二级市场股价受多种因素影响。公司目前没有正在实施的回购计划。公司会持续做好经营管理，提升盈利能力，更好地为股东创造回报，同时会加强与资本市场投资者的沟通，积极传递公司在新发展阶段的投资价值。感谢您的关注！,substantive,buyback-shareholder-return,shareholder-return / valuation-support narrative,"needs board approval, execution, and funding visibility",higher-official-signal,https://irm.cninfo.com.cn/ircs/question/questionDetail?questionId=2216447440288563200,cninfo_irm
002714.SZ,szse,2211485782545383424,2026-02-27,2026-03-09,越南猪场什么时候能开始投产？香港有计划建养猪场吗？国际投资目前除越南外还没有开始投资的？,您好，国际化是公司未来发展的重要战略之一，当前公司正在围绕战略规划稳步推进相关项目落地，同时也在积极考察和评估其他海外市场，未来会结合各地实际情况及自身发展规划，审慎推进国际化布局，为股东持续创造长期价值与回报。感谢您的关注！,directional-but-unquantified,unclassified,official interaction without a mapped investable theme,manual review required,medium-official-signal,https://irm.cninfo.com.cn/ircs/question/questionDetail?questionId=2211485782545383424,cninfo_irm
002714.SZ,szse,2214562722752393216,2026-03-03,2026-03-09,董斌你好，我想请问一下一月份二月份我们公司的全成本在多少钱？相对于十二月份有没有下降？,您好，由于2月份存在春节假期，有效销售天数少、销售数量低，因此单位期间费用分摊增加。公司2026年1-2月的平均生猪养殖成本在12元/kg左右。后续公司会持续聚焦生猪健康管理与精细化生产管理，不断提升猪群健康水平，改善各项生产指标，实现养殖成本的进一步下降。感谢您的关注！,substantive,unclassified,official interaction without a mapped investable theme,manual review required,higher-official-signal,https://irm.cninfo.com.cn/ircs/question/questionDetail?questionId=2214562722752393216,cninfo_irm
002714.SZ,szse,2214302164266414080,2026-03-03,2026-03-09,董秘你好，随着公司在香港上市引入正大等国际方面的投资者，对于公司在东南亚的布局，有什么最新的规划和安排,您好，本次香港上市是公司推进国际化战略的关键一步，公司会与正大等国际战略投资者积极探讨，结合各自优势与资源，共同挖掘相关产业发展机遇。在东南亚布局方面，当前公司已在越南建立海外发展团队，相关项目正稳步推进。同时公司也在积极考察和评估其他海外市场，未来会结合各地实际情况及自身发展规划，审慎推进国际化布局，为股东持续创造长期价值与回报。感谢您的关注！,substantive,unclassified,official interaction without a mapped investable theme,manual review required,higher-official-signal,https://irm.cninfo.com.cn/ircs/question/questionDetail?questionId=2214302164266414080,cninfo_irm
002714.SZ,szse,2214209642214961152,2026-03-03,2026-03-09,生猪养殖和猫粮狗粮结合是大趋势，请问贵公司是否考虑这个方向？高端宠物食品与生猪养殖企业的结合，关键在于‌依托现有产业链优势，向高附加值终端产品延伸‌。通过原料供应、联合生产、品牌共建等方式，将养殖端的资源优势转化为宠物食品端的市场竞争力，实现从“养殖”到“消费”的闭环升级。,您好，公司没有相关规划。感谢您的关注！,non-committal,unclassified,official interaction without a mapped investable theme,manual review required,weak-official-signal,https://irm.cninfo.com.cn/ircs/question/questionDetail?questionId=2214209642214961152,cninfo_irm
002714.SZ,szse,2213743311699132416,2026-03-02,2026-03-09,2月完全成本是多少？有没有研究出控制年底成本增加的方式方法？,您好，由于2月份存在春节假期，有效销售天数少、销售数量低，因此单位期间费用分摊增加。公司2026年1-2月的平均生猪养殖成本在12元/kg左右。后续公司会持续聚焦生猪健康管理与精细化生产管理，不断提升猪群健康水平，改善各项生产指标，实现养殖成本的进一步下降。感谢您的关注！,substantive,unclassified,official interaction without a mapped investable theme,manual review required,higher-official-signal,https://irm.cninfo.com.cn/ircs/question/questionDetail?questionId=2213743311699132416,cninfo_irm
002714.SZ,szse,2213729464737230848,2026-03-02,2026-03-09,请问贵公司2026.2月的完全成本是多少钱？谢谢,您好，由于2月份存在春节假期，有效销售天数少、销售数量低，因此单位期间费用分摊增加。公司2026年1-2月的平均生猪养殖成本在12元/kg左右。后续公司会持续聚焦生猪健康管理与精细化生产管理，不断提升猪群健康水平，改善各项生产指标，实现养殖成本的进一步下降。感谢您的关注！,substantive,unclassified,official interaction without a mapped investable theme,manual review required,higher-official-signal,https://irm.cninfo.com.cn/ircs/question/questionDetail?questionId=2213729464737230848,cninfo_irm
002714.SZ,szse,2213443059138064384,2026-03-02,2026-03-09,你好你好领导，怎么看待后期猪价走势,您好，生猪价格主要由市场供需影响。公司专注于自身经营管理，通过生猪育种、营养配方、健康管理、智能化等技术的不断创新与落地，持续提升生产效率，降低养殖成本，保证公司经营业绩的长期稳定向好。感谢您的关注！,substantive,unclassified,official interaction without a mapped investable theme,manual review required,higher-official-signal,https://irm.cninfo.com.cn/ircs/question/questionDetail?questionId=2213443059138064384,cninfo_irm
002714.SZ,szse,2210882064583688192,2026-02-26,2026-03-09,屠宰目前白条与分割品占比是多少了？各毛利率又是多少？toB能形成猪肉品牌吗？toC现在有没有做？,您好，当前公司屠宰肉食业务产品的销售结构中，分割品占比在30%左右，未来随着销售渠道的拓展和客户的挖掘，公司希望进一步提升分割品的占比，根据客户需求推出定制化的精分割产品，这类产品的附加值高于以白条形式卖出的产品，在满足市场需求的情况下，能够增强公司屠宰肉食业务的盈利能力。目前公司屠宰肉食业务服务的客户主要为大型农批经销商、连锁商超、连锁餐饮、食品加工企业、新零售企业等B端客户，关于C端销售渠道的开拓与品牌建设，公司会对相关领域的发展与市场趋势保持关注并进行审慎研究，未来会结合自身战略规划和业务发展需要综合决策相关工作。感谢您的关注！,substantive,unclassified,official interaction without a mapped investable theme,manual review required,higher-official-signal,https://irm.cninfo.com.cn/ircs/question/questionDetail?questionId=2210882064583688192,cninfo_irm
