ts_code,exchange,question_id,question_time,answer_time,question,answer,answer_class,theme,story_read,proof_needed,credibility,source_url,source_type
300476.SZ,szse,2282438008192458752,2026-06-03,,公司目前产能利用率如何，英伟达Rubin相关产品有没有正式批量出货！,,unanswered,unclassified,official interaction without a mapped investable theme,manual review required,no-company-signal,https://irm.cninfo.com.cn/ircs/question/questionDetail?questionId=2282438008192458752,cninfo_irm
300476.SZ,szse,2282437965246631936,2026-06-03,,公司新建产能，能不能在二季报中体现出来,,unanswered,unclassified,official interaction without a mapped investable theme,manual review required,no-company-signal,https://irm.cninfo.com.cn/ircs/question/questionDetail?questionId=2282437965246631936,cninfo_irm
300476.SZ,szse,2278192707699851264,2026-05-28,,尊敬的董秘，您好！贵公司的光模块pcb、正交背板竞争力到底如何，在行业中处于什么水平？另外，贵公司的产能释放情况怎样？爬坡情况如何？别跟我说什么“……产能爬坡属于……正常环节和流程”！,,unanswered,unclassified,official interaction without a mapped investable theme,manual review required,no-company-signal,https://irm.cninfo.com.cn/ircs/question/questionDetail?questionId=2278192707699851264,cninfo_irm
300476.SZ,szse,2281880787725410304,2026-06-02,,高管您好：传闻公司在N大客户的市占率一将再降；非常担忧十、十一号厂房的达产率。,,unanswered,unclassified,official interaction without a mapped investable theme,manual review required,no-company-signal,https://irm.cninfo.com.cn/ircs/question/questionDetail?questionId=2281880787725410304,cninfo_irm
300476.SZ,szse,2281764780460326912,2026-06-02,,尊敬的董秘你好，请问截止至2026年5月30日收盘公司股东人数为多少，谢谢！,,unanswered,unclassified,official interaction without a mapped investable theme,manual review required,no-company-signal,https://irm.cninfo.com.cn/ircs/question/questionDetail?questionId=2281764780460326912,cninfo_irm
300476.SZ,szse,2281169343374278656,2026-06-01,,你好，公司生产的pcb有用在AI  PC上吗？,,unanswered,unclassified,official interaction without a mapped investable theme,manual review required,no-company-signal,https://irm.cninfo.com.cn/ircs/question/questionDetail?questionId=2281169343374278656,cninfo_irm
300476.SZ,szse,2281165881829056512,2026-06-01,,董秘您好！请问截止5月31日公司股东数是多少？谢谢,,unanswered,unclassified,official interaction without a mapped investable theme,manual review required,no-company-signal,https://irm.cninfo.com.cn/ircs/question/questionDetail?questionId=2281165881829056512,cninfo_irm
300476.SZ,szse,2281128996471373824,2026-06-01,,尊敬的董秘，你好，最近英伟达AI PC芯片发布，贵司作为国内笔电最大的PCB供应商，是否对AI PC 有长期规划和产能保障，谢谢,,unanswered,unclassified,official interaction without a mapped investable theme,manual review required,no-company-signal,https://irm.cninfo.com.cn/ircs/question/questionDetail?questionId=2281128996471373824,cninfo_irm
300476.SZ,szse,2281080257182498816,2026-06-01,,董秘您好！我想查询截至2026年5月底公司最新股东人数？谢谢,,unanswered,unclassified,official interaction without a mapped investable theme,manual review required,no-company-signal,https://irm.cninfo.com.cn/ircs/question/questionDetail?questionId=2281080257182498816,cninfo_irm
300476.SZ,szse,2280971688979316736,2026-06-01,,您好，请问截止5月30日公司股东人数是多少，谢谢,,unanswered,unclassified,official interaction without a mapped investable theme,manual review required,no-company-signal,https://irm.cninfo.com.cn/ircs/question/questionDetail?questionId=2280971688979316736,cninfo_irm
300476.SZ,szse,2278813708431245312,2026-05-29,,尊敬的董秘，您好！我们作为贵公司中小投资者，对贵公司的技术实力充满信心！能否详细介绍下贵公司mSAP技术及正交背板技术的竞争力情况、产能情况、海内外大厂的认证情况及基于该技术的投产情况？盼回复！谢谢！,,unanswered,unclassified,official interaction without a mapped investable theme,manual review required,no-company-signal,https://irm.cninfo.com.cn/ircs/question/questionDetail?questionId=2278813708431245312,cninfo_irm
300476.SZ,szse,2272250483205300224,2026-05-20,2026-05-25,尊敬的董秘，提几点建议：1.与投资者的良性互动，不是反复重复大家已知的信息，请多披露一些当月的经营数据，因为是公告形式，对大家都公平，不存在违规。3.请贵公司用业绩说话，不要反复画饼，误导投资者，即使是外面一些论坛、讲话也不行，谨言慎行。4.另外，董秘这块，请多多向协创数据的董秘学习，看看人家怎么与投资者互动的，有问必答，及时回复，而不是选择性回复。谢谢！,尊敬的投资者，您好！公司高度重视市值管理工作，严格按照监管要求，立足实际经营现状，客观阐述行业格局与自身发展规划，及时、准确、完整地向市场传递最新动态。公司将继续聚焦于经营业绩的持续提升，在此基础上与资本市场投资者建立良好有效的沟通，不断增强市场信心。您的建议已知悉，谢谢关注！,directional-but-unquantified,buyback-shareholder-return,shareholder-return / valuation-support narrative,"needs board approval, execution, and funding visibility",medium-official-signal,https://irm.cninfo.com.cn/ircs/question/questionDetail?questionId=2272250483205300224,cninfo_irm
300476.SZ,szse,2272423931164581888,2026-05-20,2026-05-25,董秘您好！我想查询截至2026年5月20日公司最新股东人数？谢谢,"尊敬的投资者，您好！根据中国证券登记结算有限公司提供的数据，截至2026年5月20日，公司A股股东人数为253,760名，谢谢关注！",substantive,unclassified,official interaction without a mapped investable theme,manual review required,higher-official-signal,https://irm.cninfo.com.cn/ircs/question/questionDetail?questionId=2272423931164581888,cninfo_irm
300476.SZ,szse,2272353295934013440,2026-05-20,2026-05-25,请问公司是否涉及数据存储技术或业务？公司产品能否应用到数据数据存储、存储芯片等相关领域,尊敬的投资者，您好！公司专业从事高密度印制线路板的研发、生产和销售，产品可用于上述领域。谢谢关注！,directional-but-unquantified,unclassified,official interaction without a mapped investable theme,manual review required,medium-official-signal,https://irm.cninfo.com.cn/ircs/question/questionDetail?questionId=2272353295934013440,cninfo_irm
300476.SZ,szse,2272232770561753088,2026-05-20,2026-05-25,高管您好：市场传闻贵公司因为承担上游材料涨价而价格又传递不到客户；导致Q2业绩大幅下滑；请问是否属实？,尊敬的投资者，您好！网络流传的小道消息为不实信息。对于恶意编造传播谣言的行为，公司保留通过法律途径进行追责的权利。请投资者注意甄别信息来源，慎重决策，谢谢关注！,directional-but-unquantified,unclassified,official interaction without a mapped investable theme,manual review required,medium-official-signal,https://irm.cninfo.com.cn/ircs/question/questionDetail?questionId=2272232770561753088,cninfo_irm
300476.SZ,szse,2272102822031245312,2026-05-20,2026-05-25,董秘您好！作为公司的长期投资者，一直看好公司未来的发展，但是同时也看到近半年公司股价涨幅严重落后于其他AI硬件股，我觉得主要原因第一，公司新增产能对于业绩的转化始终没有明显体现，第二，公司在投资者互动方便的回答过于模糊，投资者对于公司新增产能落地情况，后续产品的认证，市场份额等情况的了解始终云里雾里，陈总的“拥抱AI，技术和扩产领先同行很多，5年产值目标一千亿”等等始终没有真正体现出来。,尊敬的投资者，您好！股价波动受多种因素综合影响。公司生产经营均按计划有序推进中，新厂房初期的产线磨合和产能产量逐步释放是行业的必经过程，公司对后续的生产经营及效益实现充满信心。公司严格按照监管相关规定履行信息披露义务，且受商业政策限制，未经许可公司不便讨论具体客户名称及业务情况，敬请谅解。有关公司产能进度、产品情况及战略布局等信息请查阅公司《2025年年度报告》及近期发布的投资者关系活动记录表，谢谢关注！,substantive,unclassified,official interaction without a mapped investable theme,manual review required,higher-official-signal,https://irm.cninfo.com.cn/ircs/question/questionDetail?questionId=2272102822031245312,cninfo_irm
300476.SZ,szse,2272070730035609600,2026-05-20,2026-05-25,董秘您好！在算力芯片，存储芯片这些方面，国产替代将是未来趋势，公司一贯被标以英伟达概念，请问公司和国内芯片大厂之间合作如何，营收中国内市场的比例大概多少？,尊敬的投资者，您好！受商业政策限制，未经许可公司不便讨论具体客户名称及业务情况。公司凭借领先的研发技术优势、制造技术优势和品质技术优势，与众多国内外科技巨头公司深度合作，从产品规划到技术能力提升，再到扩产计划，全程跟踪服务客户。公司国内外业务占比情况请查阅公司在中国证监会指定的创业板信息披露网站（巨潮资讯网http://www.cninfo.com.cn）上披露的定期报告。谢谢关注！,substantive,compute-power,new-demand adjacency around power + computing infrastructure,"needs revenue, order, or project economics before valuation uplift",higher-official-signal,https://irm.cninfo.com.cn/ircs/question/questionDetail?questionId=2272070730035609600,cninfo_irm
